Repo,description,created_at,updated_at,pushed_at,language,default_branch,num release,has_rn
seaweedfs/seaweedfs,"SeaweedFS is a fast distributed storage system for blobs, objects, files, and data lake, for billions of files! Blob store has O(1) disk seek, cloud tiering. Filer supports Cloud Drive, cross-DC active-active replication, Kubernetes, POSIX FUSE mount, S3 API, S3 Gateway, Hadoop, WebDAV, encryption, Erasure Coding.",2014-07-14T16:41:37Z,2023-10-25T12:08:23Z,2023-10-25T06:03:16Z,Go,master,237,True
pachyderm/pachyderm,Data-Centric Pipelines and Data Versioning,2014-09-04T07:50:02Z,2023-10-24T16:58:15Z,2023-10-25T09:06:13Z,Go,master,498,True
Y2Z/monolith,⬛️ CLI tool for saving complete web pages as a single HTML file,2017-02-20T07:47:35Z,2023-10-25T09:21:20Z,2023-09-23T13:29:41Z,Rust,master,20,True
meienberger/runtipi,"Tipi is a homeserver for everyone! One command setup, one click installs for your favorites self-hosted apps. ✨",2022-03-26T15:16:57Z,2023-10-24T20:37:40Z,2023-10-24T21:12:11Z,TypeScript,develop,101,True
stretchr/testify,A toolkit with common assertions and mocks that plays nicely with the standard library,2012-10-16T16:43:17Z,2023-10-25T08:27:23Z,2023-10-24T20:33:13Z,Go,master,12,True
jhen0409/react-native-debugger,"The standalone app based on official debugger of React Native, and includes React Inspector / Redux DevTools",2016-05-29T22:40:01Z,2023-10-24T15:43:35Z,2023-10-21T02:55:24Z,JavaScript,master,95,True
shirou/gopsutil,psutil for golang,2014-04-18T07:35:28Z,2023-10-25T08:19:33Z,2023-10-22T02:15:18Z,Go,master,13,True
HangfireIO/Hangfire,An easy way to perform background job processing in .NET and .NET Core applications. No Windows Service or separate process required,2013-08-06T09:43:04Z,2023-10-25T06:59:09Z,2023-10-20T22:09:28Z,C#,master,143,True
MichaelMure/git-bug,"Distributed, offline-first bug tracker embedded in git, with bridges",2018-07-12T07:55:57Z,2023-10-23T11:04:24Z,2023-10-23T04:39:01Z,Go,master,10,True
smacke/ffsubsync,Automagically synchronize subtitles with video.,2019-02-24T02:56:44Z,2023-10-25T09:59:23Z,2023-10-02T19:46:25Z,Python,master,10,True
gin-gonic/gin,"Gin is a HTTP web framework written in Go (Golang). It features a Martini-like API with much better performance -- up to 40 times faster. If you need smashing performance, get yourself some Gin.",2014-06-16T23:57:25Z,2023-10-25T11:04:17Z,2023-10-17T14:02:57Z,Go,master,25,True
RicoSuter/NSwag,"The Swagger/OpenAPI toolchain for .NET, ASP.NET Core and TypeScript. ",2015-09-02T19:11:57Z,2023-10-25T08:58:38Z,2023-10-24T08:56:10Z,C#,master,381,True
fkling/astexplorer,A web tool to explore the ASTs generated by various parsers.,2014-06-30T05:25:09Z,2023-10-25T02:15:44Z,2023-09-07T21:11:45Z,JavaScript,master,17,True
github/gh-ost,GitHub's Online Schema-migration Tool for MySQL,2016-03-21T10:08:52Z,2023-10-25T10:41:29Z,2023-10-25T05:08:31Z,Go,master,46,True
hajimehoshi/ebiten,Ebitengine - A dead simple 2D game engine for Go,2013-06-16T15:13:01Z,2023-10-25T07:36:06Z,2023-10-24T15:51:47Z,Go,main,127,True
CocoaPods/CocoaPods,The Cocoa Dependency Manager.,2011-08-14T00:10:53Z,2023-10-24T14:02:51Z,2023-10-19T19:30:15Z,Ruby,master,181,True
LMAX-Exchange/disruptor,High Performance Inter-Thread Messaging Library,2012-09-21T13:42:24Z,2023-10-25T07:55:27Z,2023-10-04T00:19:32Z,Java,master,14,True
felangel/bloc,A predictable state management library that helps implement the BLoC design pattern,2018-10-07T19:32:59Z,2023-10-25T08:54:21Z,2023-10-20T09:57:33Z,Dart,master,471,True
angular/angular,The modern web developer’s platform,2014-09-18T16:12:01Z,2023-10-25T11:48:36Z,2023-10-25T11:20:46Z,TypeScript,main,320,True
Hammerspoon/hammerspoon,Staggeringly powerful macOS desktop automation with Lua,2014-10-08T19:24:44Z,2023-10-25T09:27:10Z,2023-10-11T15:28:04Z,Objective-C,master,100,True
muaz-khan/RecordRTC,"RecordRTC is WebRTC JavaScript library for audio/video as well as screen activity recording. It supports Chrome, Firefox, Opera, Android, and Microsoft Edge. Platforms: Linux, Mac and Windows.",2014-07-30T11:07:04Z,2023-10-24T08:55:51Z,2023-05-03T19:33:33Z,JavaScript,master,43,True
junit-team/junit5,✅ The 5th major version of the programmer-friendly testing framework for Java and the JVM,2015-01-11T19:06:10Z,2023-10-25T03:15:25Z,2023-10-23T08:33:34Z,Java,main,64,True
ReactiveCocoa/ReactiveCocoa,Cocoa framework and Obj-C dynamism bindings for ReactiveSwift.,2012-03-02T22:11:24Z,2023-10-24T14:03:03Z,2023-06-24T19:10:55Z,Swift,master,83,True
electronicarts/EASTL,EASTL stands for Electronic Arts Standard Template Library.  It is an extensive and robust implementation that has an emphasis on high performance.,2015-12-15T21:04:13Z,2023-10-24T16:41:44Z,2023-08-16T17:55:47Z,C++,master,46,True
php-fig/log,,2012-11-30T09:49:24Z,2023-10-24T14:03:21Z,2023-07-21T11:30:36Z,PHP,master,10,True
stefanprodan/dockprom,"Docker hosts and containers monitoring with Prometheus, Grafana, cAdvisor, NodeExporter and AlertManager",2016-09-25T14:49:44Z,2023-10-25T03:23:24Z,2023-10-06T13:56:55Z,,master,160,True
tiangolo/typer,"Typer, build great CLIs. Easy to code. Based on Python type hints.",2019-12-24T12:24:11Z,2023-10-25T12:12:09Z,2023-10-23T19:28:24Z,Python,master,26,True
ptomasroos/react-native-scrollable-tab-view,"Tabbed navigation that you can swipe between, each tab can have  its own ScrollView and maintain its own scroll position between swipes. Pleasantly animated. Customizable tab bar",2015-06-11T05:01:07Z,2023-10-24T15:43:40Z,2023-08-04T03:00:51Z,JavaScript,master,2,True
bigbluebutton/bigbluebutton,Complete open source web conferencing system.,2010-05-25T01:42:41Z,2023-10-24T14:02:32Z,2023-10-25T11:46:24Z,JavaScript,develop,207,True
thoughtbot/bourbon,A Lightweight Sass Tool Set,2011-04-23T15:41:20Z,2023-10-19T16:24:20Z,2023-07-06T13:07:01Z,Ruby,main,55,True
typicode/lowdb,"Simple to use local JSON database. Use native JavaScript API to query. Written in TypeScript. (supports Node, Electron and the browser)",2014-04-02T02:16:06Z,2023-10-25T11:32:59Z,2023-10-23T16:10:37Z,JavaScript,main,31,True
maxgoedjen/secretive,Store SSH keys in the Secure Enclave,2020-02-19T03:34:45Z,2023-10-24T19:39:48Z,2023-09-21T11:13:00Z,Swift,main,20,True
Netflix/conductor,Conductor is a microservices orchestration engine.,2016-12-07T22:48:42Z,2023-10-25T12:13:16Z,2023-10-24T06:36:40Z,Java,main,318,True
tensorflow/serving,"A flexible, high-performance serving system for machine learning models",2016-01-26T21:48:20Z,2023-10-25T07:37:05Z,2023-10-25T07:04:07Z,C++,master,109,True
popcorn-official/popcorn-desktop,"Popcorn Time is a multi-platform, free software BitTorrent client that includes an integrated media player ( Windows / Mac / Linux ) A Butter-Project Fork",2016-02-16T11:07:20Z,2023-10-24T23:42:19Z,2023-10-22T16:43:06Z,JavaScript,development,6,True
apache/dubbo-spring-boot-project,Spring Boot Project for Apache Dubbo,2018-01-18T12:10:50Z,2023-10-20T08:45:54Z,2023-01-25T00:11:57Z,Java,master,13,True
laurent22/joplin,"Joplin - the secure note taking and to-do app with synchronisation capabilities for Windows, macOS, Linux, Android and iOS.",2017-01-16T21:49:41Z,2023-10-25T11:48:28Z,2023-10-25T07:21:50Z,TypeScript,dev,307,True
verekia/js-stack-from-scratch,🛠️⚡ Step-by-step tutorial to build a modern JavaScript stack.,2016-10-02T13:31:23Z,2023-10-24T12:13:34Z,2022-11-01T03:50:36Z,JavaScript,master,1,True
bitcoin/bitcoin,Bitcoin Core integration/staging tree,2010-12-19T15:16:43Z,2023-10-25T12:15:05Z,2023-10-25T12:13:18Z,C++,master,44,True
apple/swift-nio,"Event-driven network application framework for high performance protocol servers & clients, non-blocking.",2018-02-06T17:47:31Z,2023-10-24T14:02:43Z,2023-10-25T10:24:44Z,Swift,main,125,True
serbanghita/Mobile-Detect,Mobile_Detect is a lightweight PHP class for detecting mobile devices (including tablets). It uses the User-Agent string combined with specific HTTP headers to detect the mobile environment.,2012-08-31T10:58:16Z,2023-10-25T09:45:44Z,2023-10-18T18:33:19Z,PHP,4.8.x,3,True
microsoft/unilm,"Large-scale Self-supervised Pre-training Across Tasks, Languages, and Modalities",2019-07-23T04:15:28Z,2023-10-25T12:14:21Z,2023-10-22T00:15:08Z,Python,master,3,True
SergioBenitez/Rocket,A web framework for Rust.,2016-03-18T02:50:18Z,2023-10-25T12:00:57Z,2023-10-23T14:06:48Z,Rust,master,54,True
tealeg/xlsx,Go library for reading and writing XLSX files. ,2011-06-28T15:20:28Z,2023-10-25T07:15:19Z,2023-10-24T04:48:32Z,Go,master,18,True
GoogleChrome/workbox,📦 Workbox: JavaScript libraries for Progressive Web Apps,2016-04-04T15:55:19Z,2023-10-25T01:52:53Z,2023-10-18T22:54:26Z,JavaScript,v7,83,True
redis/node-redis,Redis Node.js client,2010-09-14T02:05:09Z,2023-10-25T01:40:00Z,2023-10-24T22:54:19Z,TypeScript,master,117,True
maxence-charriere/go-app,A package to build progressive web apps with Go programming language and WebAssembly.,2016-10-12T00:31:33Z,2023-10-25T10:02:49Z,2023-10-25T08:38:48Z,Go,master,91,True
reduxjs/redux,Predictable state container for JavaScript apps,2015-05-29T23:53:15Z,2023-10-25T09:06:53Z,2023-10-23T16:10:25Z,TypeScript,master,74,True
jaredpalmer/razzle,✨ Create server-rendered universal JavaScript applications with no configuration,2016-02-10T18:34:27Z,2023-10-24T18:30:01Z,2023-03-03T11:46:25Z,JavaScript,master,253,True
getlantern/lantern,"Lantern官方版本下载 蓝灯 翻墙 代理 科学上网 外网 加速器 梯子 路由 - Быстрый, надежный и безопасный доступ к открытому интернету - lantern proxy vpn censorship-circumvention censorship gfw accelerator پراکسی لنترن، ضدسانسور، امن، قابل اعتماد و پرسرعت",2011-02-17T22:12:29Z,2023-10-25T07:58:22Z,2023-10-19T14:46:03Z,Go,devel,131,True
cli/cli,GitHub’s official command line tool,2019-10-03T15:24:53Z,2023-10-25T12:15:41Z,2023-10-25T11:18:47Z,Go,trunk,114,True
vuejs/pinia,"🍍 Intuitive, type safe, light and flexible Store for Vue using the composition api with DevTools support",2019-11-18T21:05:01Z,2023-10-25T11:29:12Z,2023-10-24T16:01:17Z,TypeScript,v2,98,True
StevenBlack/hosts,"🔒 Consolidating and extending hosts files from several well-curated sources. Optionally pick extensions for porn, social media, and other categories.",2012-04-12T20:22:50Z,2023-10-25T11:09:59Z,2023-10-23T13:14:47Z,Python,master,590,True
redis/go-redis,Redis Go client,2012-07-25T13:01:39Z,2023-10-25T04:27:57Z,2023-10-25T06:52:16Z,Go,master,23,True
codecentric/spring-boot-admin,Admin UI for administration of spring boot applications,2014-07-25T11:39:13Z,2023-10-25T09:05:23Z,2023-10-25T06:57:48Z,Java,master,111,True
opf/openproject,OpenProject is the leading open source project management software.,2012-11-28T09:59:11Z,2023-10-24T19:52:32Z,2023-10-25T12:18:15Z,Ruby,dev,93,True
fantasyland/fantasy-land,Specification for interoperability of common algebraic structures in JavaScript,2013-04-12T03:10:22Z,2023-10-25T10:32:36Z,2023-09-24T08:18:15Z,JavaScript,master,20,True
symfony/process,Executes commands in sub-processes,2011-02-22T18:04:37Z,2023-10-24T23:59:14Z,2023-10-21T14:30:35Z,PHP,6.3,132,True
dropzone/dropzone,Dropzone is an easy to use drag'n'drop library. It supports image previews and shows nice progress bars.,2012-02-12T16:19:18Z,2023-10-25T10:34:22Z,2023-09-26T18:22:53Z,JavaScript,main,44,True
facebookresearch/fairseq,Facebook AI Research Sequence-to-Sequence Toolkit written in Python.,2017-08-29T16:26:12Z,2023-10-25T10:58:10Z,2023-10-25T09:47:42Z,Python,main,16,True
yarolegovich/DiscreteScrollView,A scrollable list of items that centers the current element and provides easy-to-use APIs for cool item animations.,2017-03-03T23:38:54Z,2023-10-24T17:58:05Z,2021-08-30T09:15:17Z,Java,master,2,True
Shopify/draggable,The JavaScript Drag & Drop library your grandparents warned you about.,2017-09-27T15:31:23Z,2023-10-25T10:18:09Z,2023-10-19T15:51:52Z,JavaScript,main,17,True
snapappointments/bootstrap-select,":rocket: The jQuery plugin that brings select elements into the 21st century with intuitive multiselection, searching, and much more.",2012-09-26T20:56:59Z,2023-10-24T16:24:39Z,2023-09-06T14:13:23Z,JavaScript,main,75,True
nhn/tui.chart,🍞📊  Beautiful chart for data visualization.,2015-07-31T01:18:56Z,2023-10-23T11:10:37Z,2023-10-05T00:37:48Z,TypeScript,main,89,True
amark/gun,An open source cybersecurity protocol for syncing decentralized graph data.,2014-07-31T15:52:10Z,2023-10-25T04:28:49Z,2023-10-19T18:43:47Z,JavaScript,master,17,True
krzyzanowskim/CryptoSwift,CryptoSwift is a growing collection of standard and secure cryptographic algorithms implemented in Swift,2014-07-06T07:31:39Z,2023-10-25T07:24:21Z,2023-09-24T11:58:47Z,Swift,main,49,True
GoogleCloudPlatform/terraformer,CLI tool to generate terraform files from existing infrastructure (reverse Terraform). Infrastructure to Code,2019-05-01T22:37:33Z,2023-10-25T05:03:10Z,2023-10-17T14:23:51Z,Go,master,33,True
styled-components/styled-components,Visual primitives for the component age. Use the best bits of ES6 and CSS to style your apps without stress 💅,2016-08-16T06:41:32Z,2023-10-25T11:17:42Z,2023-10-18T17:56:07Z,TypeScript,main,157,True
antonioru/beautiful-react-hooks,🔥 A collection of beautiful and (hopefully) useful React hooks to speed-up your components and hooks development 🔥,2019-12-18T19:50:43Z,2023-10-25T08:13:04Z,2023-10-23T12:54:25Z,JavaScript,master,57,True
Ramotion/folding-cell,:octocat: 📃 FoldingCell is an expanding content cell with animation made by @Ramotion,2015-12-21T14:29:48Z,2023-10-25T12:04:35Z,2022-03-28T12:16:52Z,Swift,master,1,True
BetterDiscord/BetterDiscord,Better Discord enhances Discord desktop app with new features.,2017-10-01T20:51:14Z,2023-10-25T12:02:48Z,2023-10-19T19:38:27Z,JavaScript,main,34,True
DrKLO/Telegram,Telegram for Android source,2013-10-25T14:08:10Z,2023-10-25T07:54:00Z,2023-10-19T03:15:02Z,Java,master,82,True
tw93/Pake,🤱🏻 Turn any webpage into a desktop app with Rust.  🤱🏻 利用 Rust 轻松构建轻量级多端桌面应用,2022-10-14T09:32:57Z,2023-10-25T09:31:36Z,2023-10-18T11:38:42Z,Rust,master,25,True
thoughtbot/factory_bot,A library for setting up Ruby objects as test data.,2008-06-03T13:55:37Z,2023-10-24T14:25:44Z,2023-10-20T21:21:38Z,Ruby,main,18,True
connors/photon,The fastest way to build beautiful Electron apps using simple HTML and CSS,2015-09-28T04:03:26Z,2023-10-25T02:31:11Z,2022-10-23T10:19:31Z,CSS,master,3,True
segmentio/kafka-go,Kafka library in Go,2017-05-09T22:50:27Z,2023-10-25T10:32:35Z,2023-10-20T00:33:41Z,Go,main,25,True
angular-ui/ui-grid,UI Grid: an Angular Data Grid,2012-10-13T01:39:25Z,2023-10-25T07:15:01Z,2023-10-16T20:47:00Z,JavaScript,master,62,True
fengyuanchen/cropperjs,JavaScript image cropper.,2015-09-25T10:57:53Z,2023-10-25T10:13:53Z,2023-09-17T03:47:10Z,JavaScript,main,69,True
infinitered/ignite,"Infinite Red's battle-tested React Native project boilerplate, along with a CLI, component/model generators, and more!",2016-02-10T16:06:07Z,2023-10-25T10:10:33Z,2023-10-23T20:14:23Z,TypeScript,master,194,True
smartystreets/goconvey,Go testing in the browser. Integrates with `go test`. Write behavioral tests in Go.,2013-08-21T04:52:28Z,2023-10-23T11:05:20Z,2023-07-27T17:00:21Z,Go,master,10,True
AutoHotkey/AutoHotkey,AutoHotkey - macro-creation and automation-oriented scripting utility for Windows.,2009-11-25T11:08:21Z,2023-10-25T11:35:13Z,2023-10-14T11:00:05Z,C++,alpha,85,True
naman14/Timber,Material Design Music Player,2015-06-12T16:43:55Z,2023-10-23T09:10:52Z,2023-04-28T07:13:46Z,Java,master,5,True
joelittlejohn/jsonschema2pojo,"Generate Java types from JSON or JSON Schema and annotate those types for data-binding with Jackson, Gson, etc",2013-06-22T22:28:53Z,2023-10-23T11:05:02Z,2023-10-14T14:21:04Z,Java,master,62,True
symfony/debug,Provides tools to ease debugging PHP code,2013-04-07T19:13:19Z,2023-10-24T23:59:58Z,2022-07-29T12:25:06Z,PHP,4.4,36,True
keras-team/autokeras,AutoML library for deep learning,2017-11-19T23:18:20Z,2023-10-23T11:03:11Z,2023-10-02T22:40:56Z,Python,master,58,True
shadcn/ui,Beautifully designed components built with Radix UI and Tailwind CSS.,2023-01-04T12:43:27Z,2023-10-25T12:14:41Z,2023-10-25T09:11:26Z,TypeScript,main,12,True
cloudflare/quiche,🥧 Savoury implementation of the QUIC transport protocol and HTTP/3,2018-09-29T18:22:05Z,2023-10-25T07:45:49Z,2023-10-24T23:06:06Z,Rust,master,21,True
google-deepmind/pysc2,StarCraft II Learning Environment,2017-07-25T18:16:57Z,2023-10-24T14:32:54Z,2023-07-09T00:54:49Z,Python,master,6,True
givanz/VvvebJs,Drag and drop website builder javascript library.,2017-10-11T15:39:02Z,2023-10-25T01:32:27Z,2023-10-17T14:18:04Z,JavaScript,master,12,True
cloudflare/boringtun,Userspace WireGuard® Implementation in Rust,2018-10-12T19:27:06Z,2023-10-25T01:14:08Z,2023-10-25T07:13:38Z,Rust,master,6,True
activerecord-hackery/ransack,Object-based searching. ,2011-03-31T00:34:25Z,2023-10-24T22:47:37Z,2023-10-24T17:34:51Z,Ruby,main,36,True
mbdavid/LiteDB,LiteDB - A .NET NoSQL Document Store in a single data file,2014-08-25T13:49:30Z,2023-10-25T03:25:06Z,2023-08-11T13:34:26Z,C#,master,53,True
hyperium/hyper,An HTTP library for Rust,2014-08-30T21:14:33Z,2023-10-25T09:36:04Z,2023-10-24T12:27:16Z,Rust,master,167,True
iSoron/uhabits,"Loop Habit Tracker, a mobile app for creating and maintaining long-term positive habits",2014-11-08T11:07:12Z,2023-10-25T09:44:56Z,2023-10-01T12:18:10Z,Kotlin,dev,41,True
baldurk/renderdoc,RenderDoc is a stand-alone graphics debugging tool.,2014-02-27T15:16:30Z,2023-10-25T01:08:05Z,2023-10-24T10:19:18Z,C++,v1.x,48,True
fish-shell/fish-shell,The user-friendly command line shell.,2012-05-10T03:00:55Z,2023-10-25T11:30:46Z,2023-10-24T16:27:07Z,C++,master,39,True
zeek/zeek,Zeek is a powerful network analysis framework that is much different from the typical IDS you may know.,2012-07-06T20:30:16Z,2023-10-25T07:07:55Z,2023-10-25T10:57:44Z,C++,master,67,True
Shopify/toxiproxy,:alarm_clock: :fire: A TCP proxy to simulate network and system conditions for chaos and resiliency testing,2014-09-04T13:56:38Z,2023-10-24T12:48:08Z,2023-10-19T18:04:32Z,Go,main,26,True
zenoamaro/react-quill,A Quill component for React.,2014-11-07T12:25:40Z,2023-10-25T03:08:07Z,2023-08-23T10:01:45Z,JavaScript,master,18,True
google/material-design-icons,Material Design icons by Google,2014-10-08T18:01:28Z,2023-10-25T11:42:44Z,2023-10-20T08:50:19Z,,master,16,True
uber/cadence,"Cadence is a distributed, scalable, durable, and highly available orchestration engine to execute asynchronous long-running business logic in a scalable and resilient way.",2017-02-21T16:10:18Z,2023-10-25T10:43:42Z,2023-10-24T07:15:24Z,Go,master,76,True
mediaelement/mediaelement,"HTML5 <audio> or <video> player with support for MP4, WebM, and MP3 as well as HLS, Dash, YouTube, Facebook, SoundCloud and others with a common HTML5 MediaElement API, enabling a consistent UI in all browsers.",2010-07-28T02:32:56Z,2023-10-23T12:33:36Z,2023-10-16T12:25:35Z,JavaScript,master,69,True
c0re100/qBittorrent-Enhanced-Edition,"[Unofficial] qBittorrent Enhanced, based on qBittorrent",2017-03-14T03:30:46Z,2023-10-25T11:39:41Z,2023-08-31T15:43:00Z,C++,v4_5_x,81,True
DevExpress/testcafe,A Node.js tool to automate end-to-end web testing.,2015-04-20T13:43:28Z,2023-10-25T03:16:02Z,2023-10-25T10:48:12Z,JavaScript,master,408,True
square/leakcanary,A memory leak detection library for Android.,2015-04-29T23:54:16Z,2023-10-25T10:39:15Z,2023-10-24T13:28:59Z,Kotlin,main,33,True
coreybutler/nvm-windows,A node.js version management utility for Windows. Ironically written in Go.,2014-09-20T16:37:28Z,2023-10-25T08:14:48Z,2023-10-10T17:21:00Z,Go,master,19,True
mmistakes/minimal-mistakes,":triangular_ruler: Jekyll theme for building a personal site, blog, project documentation, or portfolio.",2013-05-24T14:13:30Z,2023-10-24T15:57:07Z,2023-10-25T11:36:37Z,HTML,master,114,True
openssl/openssl,TLS/SSL and crypto library,2013-01-15T22:34:48Z,2023-10-25T11:12:24Z,2023-10-25T12:14:53Z,C,master,19,True
tweepy/tweepy,Twitter for Python!,2009-07-06T04:15:34Z,2023-10-24T14:23:53Z,2023-09-25T13:56:57Z,Python,master,31,True
expressjs/session,Simple session middleware for Express,2014-02-16T00:38:44Z,2023-10-24T13:16:27Z,2023-10-13T08:27:56Z,JavaScript,master,58,True
universal-ctags/ctags,A maintained ctags implementation,2010-03-25T10:43:13Z,2023-10-25T07:06:39Z,2023-10-23T06:27:48Z,C,master,1,True
dgtlmoon/changedetection.io,"The best and simplest free open source website change detection, restock monitor and notification service. Restock Monitor, change detection. Designed for simplicity - Simply monitor which websites had a text change for free. Free Open source web page change detection, Website defacement monitoring, Price change and Price Drop notification",2021-01-27T16:03:30Z,2023-10-25T05:51:53Z,2023-10-25T11:31:33Z,Python,master,71,True
ppoffice/hexo-theme-icarus,"A simple, delicate, and modern theme for the static site generator Hexo.",2015-03-19T14:24:24Z,2023-10-25T03:18:31Z,2023-09-17T01:54:16Z,JavaScript,master,44,True
musescore/MuseScore,"MuseScore is an open source and free music notation software. For support, contribution, bug reports, visit MuseScore.org. Fork and make pull requests!",2012-05-26T12:46:33Z,2023-10-25T02:31:18Z,2023-10-25T10:45:25Z,C++,master,51,True
NVIDIA/NeMo,NeMo: a toolkit for conversational AI,2019-08-05T20:16:42Z,2023-10-25T12:20:56Z,2023-10-25T10:10:21Z,Python,main,44,True
yarnpkg/berry,📦🐈 Active development trunk for Yarn ⚒,2018-09-10T22:49:22Z,2023-10-25T12:19:11Z,2023-10-25T10:41:45Z,TypeScript,master,28,True
dc-js/dc.js,Multi-Dimensional charting built to work natively with crossfilter rendered with d3.js,2012-06-19T14:20:30Z,2023-10-24T14:26:11Z,2023-10-05T16:40:20Z,JavaScript,develop,28,True
dotansimha/graphql-yoga,"🧘 Rewrite of a fully-featured GraphQL Server with focus on easy setup, performance & great developer experience.  The core of Yoga implements WHATWG Fetch API and can run/deploy on any JS environment.",2017-11-15T10:35:08Z,2023-10-24T16:08:22Z,2023-10-25T12:01:37Z,TypeScript,main,340,True
syncthing/syncthing,Open Source Continuous File Synchronization,2013-11-26T09:48:21Z,2023-10-25T12:14:05Z,2023-10-25T09:16:24Z,Go,main,347,True
unicorn-engine/unicorn,"Unicorn CPU emulator framework (ARM, AArch64, M68K, Mips, Sparc, PowerPC, RiscV, S390x, TriCore, X86)",2015-08-20T16:35:45Z,2023-10-25T12:08:59Z,2023-10-24T20:04:15Z,C,master,24,True
joke2k/faker,Faker is a Python package that generates fake data for you.,2012-11-12T23:00:09Z,2023-10-25T01:07:18Z,2023-10-25T03:44:54Z,Python,master,215,True
ageitgey/face_recognition,The world's simplest facial recognition api for Python and the command line,2017-03-03T21:52:39Z,2023-10-25T11:57:33Z,2023-10-18T08:51:11Z,Python,master,2,True
telegramdesktop/tdesktop,Telegram Desktop messaging app,2014-05-02T12:36:31Z,2023-10-25T11:09:57Z,2023-10-25T10:23:50Z,C++,dev,649,True
bobthecow/psysh,A REPL for PHP,2012-06-04T17:15:35Z,2023-10-24T23:54:54Z,2023-10-15T12:44:59Z,PHP,main,99,True
rt2zz/redux-persist,persist and rehydrate a redux store,2015-07-23T04:43:58Z,2023-10-25T11:37:45Z,2023-06-16T21:44:39Z,TypeScript,master,12,True
jquery/jquery,jQuery JavaScript Library,2009-04-03T15:20:14Z,2023-10-25T08:47:02Z,2023-10-25T02:13:55Z,JavaScript,main,8,True
wolfpld/tracy,Frame profiler,2020-03-17T19:43:04Z,2023-10-25T12:20:45Z,2023-10-25T11:02:56Z,C++,master,16,True
swc-project/swc,Rust-based platform for the Web,2017-12-22T11:40:14Z,2023-10-25T12:14:12Z,2023-10-25T00:07:04Z,Rust,main,296,True
expressjs/express,"Fast, unopinionated, minimalist web framework for node.",2009-06-26T18:56:01Z,2023-10-25T10:35:31Z,2023-10-24T06:45:44Z,JavaScript,master,147,True
leongersen/noUiSlider,"noUiSlider is a lightweight, ARIA-accessible JavaScript range slider with multi-touch and keyboard support. It is fully GPU animated: no reflows, so it is fast; even on older devices. It also fits wonderfully in responsive designs and has no dependencies.",2011-11-19T12:38:41Z,2023-10-23T11:03:00Z,2023-08-02T15:44:02Z,TypeScript,master,81,True
mac-cain13/R.swift,"Strong typed, autocompleted resources like images, fonts and segues in Swift projects",2014-12-11T21:36:17Z,2023-10-25T04:12:00Z,2023-09-28T15:45:24Z,Swift,main,110,True
veler/DevToys,A Swiss Army knife for developers.,2021-09-29T01:40:41Z,2023-10-25T11:26:02Z,2023-10-25T00:31:38Z,C#,main,30,True
samratashok/nishang,"Nishang - Offensive PowerShell for red team, penetration testing and offensive security. ",2014-05-19T11:48:24Z,2023-10-24T20:51:35Z,2023-09-05T07:54:08Z,PowerShell,master,7,True
zo0r/react-native-push-notification,React Native Local and Remote Notifications,2015-12-14T19:53:36Z,2023-10-23T11:12:16Z,2023-10-03T10:54:42Z,Java,master,35,True
EsotericSoftware/kryo,"Java binary serialization and cloning: fast, efficient, automatic",2013-11-06T13:24:03Z,2023-10-25T09:17:43Z,2023-10-17T14:42:50Z,HTML,master,32,True
flutter/gallery,Flutter Gallery is a resource to help developers evaluate and use Flutter,2020-03-05T17:46:11Z,2023-10-25T09:18:31Z,2023-10-24T16:01:36Z,Dart,main,11,True
microsoft/napajs,Napa.js: a multi-threaded JavaScript runtime,2017-07-18T21:41:10Z,2023-10-23T11:02:33Z,2022-08-29T14:03:08Z,C++,master,14,True
kyleneideck/BackgroundMusic,"Background Music, a macOS audio utility: automatically pause your music, set individual apps' volumes and record system audio.",2016-02-24T07:19:32Z,2023-10-25T11:50:37Z,2022-11-27T05:01:20Z,C++,master,43,True
apache/echarts,"Apache ECharts is a powerful, interactive charting and data visualization library for browser",2013-04-03T03:18:59Z,2023-10-25T08:50:32Z,2023-10-25T09:25:53Z,TypeScript,master,111,True
jsdom/jsdom,"A JavaScript implementation of various web standards, for use with Node.js",2010-01-19T06:55:19Z,2023-10-25T12:14:39Z,2023-10-24T06:22:05Z,JavaScript,master,43,True
