Repo,description,created_at,updated_at,pushed_at,language,default_branch,num release,has_rn
uxsolutions/bootstrap-datepicker,A datepicker for twitter bootstrap (@twbs),2012-03-17T01:11:40Z,2023-10-23T12:42:16Z,2023-09-22T14:19:31Z,JavaScript,master,19,True
spacejam/sled,the champagne of beta embedded databases,2016-01-11T04:11:30Z,2023-10-25T10:11:08Z,2023-10-25T10:49:40Z,Rust,main,22,True
mawww/kakoune,mawww's experiment for a better code editor,2011-11-03T12:43:55Z,2023-10-25T02:07:33Z,2023-10-25T10:58:55Z,C++,master,16,True
jesseduffield/lazygit,simple terminal UI for git commands,2018-05-19T00:53:06Z,2023-10-25T07:15:32Z,2023-10-24T15:27:08Z,Go,master,148,True
vercel/satori,Enlightened library to convert HTML and CSS to SVG,2022-01-27T17:01:04Z,2023-10-25T09:14:31Z,2023-10-21T09:07:53Z,TypeScript,main,54,True
jorgebucaran/fisher,A plugin manager for Fish,2015-09-24T23:38:39Z,2023-10-24T16:47:35Z,2023-08-29T17:08:01Z,Shell,main,61,True
nccgroup/ScoutSuite,Multi-Cloud Security Auditing Tool,2018-10-30T11:46:54Z,2023-10-24T19:30:07Z,2023-10-20T08:33:16Z,Python,master,34,True
dtm-labs/dtm,"A distributed transaction framework, supports workflow, saga, tcc, xa, 2-phase message, outbox patterns, supports many languages.",2021-05-16T00:56:28Z,2023-10-25T11:15:54Z,2023-10-24T01:56:47Z,Go,main,79,True
mahmoud/boltons,"🔩 Like builtins, but boltons. 250+ constructs, recipes, and snippets which extend (and rely on nothing but) the Python standard library.  Nothing like Michael Bolton.",2013-02-20T06:17:12Z,2023-10-23T14:56:57Z,2023-10-13T22:10:12Z,Python,master,19,True
Homebrew/brew,🍺 The missing package manager for macOS (or Linux),2016-03-06T05:08:38Z,2023-10-25T12:27:05Z,2023-10-25T11:31:05Z,Ruby,master,334,True
prevwong/craft.js,🚀 A React Framework for building extensible drag and drop page editors,2019-06-04T18:08:50Z,2023-10-25T10:08:51Z,2023-10-22T10:12:19Z,TypeScript,main,29,True
apertureless/vue-chartjs,📊  Vue.js wrapper for Chart.js,2016-06-26T13:25:12Z,2023-10-24T14:59:24Z,2023-10-20T22:44:35Z,TypeScript,main,75,True
Bash-it/bash-it,A community Bash framework.,2010-10-02T18:36:17Z,2023-10-24T19:26:38Z,2023-10-23T21:47:42Z,Shell,master,13,True
knadh/listmonk,"High performance, self-hosted, newsletter and mailing list manager with a modern dashboard. Single binary app.",2019-06-26T05:08:39Z,2023-10-25T12:01:53Z,2023-10-19T16:53:12Z,Go,master,28,True
google/osv-scanner,Vulnerability scanner written in Go which uses the data provided by https://osv.dev,2022-11-14T01:05:20Z,2023-10-25T12:41:11Z,2023-10-25T05:55:30Z,Go,main,15,True
oracle/graal,GraalVM: Run Programs Faster Anywhere :rocket:,2016-01-14T17:11:35Z,2023-10-25T12:15:01Z,2023-10-25T12:50:49Z,Java,master,32,True
Tapadoo/Alerter,An Android Alerting Library,2017-02-03T16:50:47Z,2023-10-24T05:07:39Z,2023-07-21T08:28:18Z,Kotlin,master,6,True
claudiodangelis/qrcp,:zap: Transfer files over wifi from your computer to your mobile device by scanning a QR code without leaving the terminal.,2018-01-14T22:35:55Z,2023-10-25T11:14:34Z,2023-09-27T09:25:20Z,Go,main,22,True
source-foundry/Hack,A typeface designed for source code,2015-06-21T22:47:58Z,2023-10-25T09:58:15Z,2022-11-21T18:05:33Z,Shell,master,15,True
auth0/java-jwt,Java implementation of JSON Web Token (JWT),2014-03-07T15:06:11Z,2023-10-25T10:47:28Z,2023-09-18T14:18:09Z,Java,master,44,True
fastai/fastai,The fastai deep learning library,2017-09-09T17:43:36Z,2023-10-25T10:55:51Z,2023-10-24T07:02:50Z,Jupyter Notebook,master,50,True
pallets/jinja,A very fast and expressive template engine.,2010-10-17T13:41:17Z,2023-10-25T04:24:20Z,2023-10-25T09:40:32Z,Python,main,17,True
PHPOffice/PHPWord,A pure PHP library for reading and writing word processing documents,2012-05-06T16:04:30Z,2023-10-25T08:35:04Z,2023-10-24T15:52:54Z,PHP,master,22,True
openlayers/openlayers,OpenLayers,2012-06-20T06:53:59Z,2023-10-25T12:08:38Z,2023-10-24T16:35:11Z,JavaScript,main,122,True
PCSX2/pcsx2,PCSX2 - The Playstation 2 Emulator,2013-12-22T17:56:48Z,2023-10-25T12:23:49Z,2023-10-25T12:34:12Z,C++,master,3139,True
spree/spree,Open Source multi-language/multi-currency/multi-store eCommerce platform,2008-03-10T14:45:35Z,2023-10-25T10:28:57Z,2023-10-23T18:43:56Z,Ruby,main,178,True
mysticatea/npm-run-all,A CLI tool to run multiple npm-scripts in parallel or sequential.,2015-03-23T11:18:26Z,2023-10-23T21:25:26Z,2023-06-25T03:43:56Z,JavaScript,master,51,True
assimp/assimp,The official Open-Asset-Importer-Library Repository. Loads 40+ 3D-file-formats into one unified and clean data structure. ,2010-05-05T12:53:45Z,2023-10-25T05:41:44Z,2023-10-25T04:51:14Z,C++,master,30,True
benphelps/homepage,A highly customizable homepage (or startpage / application dashboard) with Docker and service API integrations.,2022-08-24T07:29:42Z,2023-10-25T12:06:50Z,2023-10-24T21:09:57Z,JavaScript,main,67,True
SonarSource/sonarqube,Continuous Inspection,2011-01-05T11:05:17Z,2023-10-25T08:50:56Z,2023-10-24T20:03:07Z,Java,master,42,True
dmlc/dgl,"Python package built to ease deep learning on graph, on top of existing DL frameworks.",2018-04-20T14:49:09Z,2023-10-25T12:07:37Z,2023-10-25T09:57:17Z,Python,master,33,True
insin/nwb,"A toolkit for React, Preact, Inferno & vanilla JS apps, React libraries and other npm modules for the web, with no configuration (until you need it)",2015-11-10T23:32:58Z,2023-10-23T11:11:49Z,2023-10-16T13:32:05Z,JavaScript,master,92,True
flarum/flarum,Simple forum software for building great communities.,2014-12-30T11:13:08Z,2023-10-25T11:45:18Z,2023-05-20T18:24:59Z,PHP,master,23,True
hashicorp/vault,"A tool for secrets management, encryption as a service, and privileged access management",2015-02-25T00:15:59Z,2023-10-25T11:36:38Z,2023-10-25T13:04:01Z,Go,main,114,True
imsnif/bandwhich,Terminal bandwidth utilization tool,2019-09-06T21:08:33Z,2023-10-25T09:01:07Z,2023-10-23T11:52:45Z,Rust,main,24,True
smallnest/rpcx,"Best microservices framework in Go, like alibaba Dubbo, but with more features, Scale easily. Try it. Test it. If you feel it's better, use it! 𝐉𝐚𝐯𝐚有𝐝𝐮𝐛𝐛𝐨, 𝐆𝐨𝐥𝐚𝐧𝐠有𝐫𝐩𝐜𝐱! build for cloud!",2016-05-18T09:34:05Z,2023-10-24T17:50:06Z,2023-10-19T06:17:46Z,Go,master,1,True
jwtk/jjwt,Java JWT: JSON Web Token for Java and Android,2014-09-13T01:06:24Z,2023-10-25T10:49:24Z,2023-10-15T03:19:07Z,Java,master,4,True
fulldecent/system-bus-radio,Transmits AM radio on computers without radio transmitting hardware.,2016-02-29T21:48:56Z,2023-10-24T12:07:39Z,2023-02-02T00:02:28Z,C,master,1,True
dokku/dokku,A docker-powered PaaS that helps you build and manage the lifecycle of applications,2013-06-08T10:26:57Z,2023-10-25T05:10:01Z,2023-10-24T23:53:11Z,Shell,master,254,True
tymondesigns/jwt-auth,🔐 JSON Web Token Authentication for Laravel & Lumen,2014-09-04T21:50:50Z,2023-10-25T04:03:29Z,2023-10-05T19:34:35Z,PHP,2.x,49,True
OJ/gobuster,"Directory/File, DNS and VHost busting tool written in Go",2014-11-14T13:18:35Z,2023-10-25T08:25:04Z,2023-10-18T18:51:59Z,Go,master,9,True
chrisbanes/tivi,"Tivi is a TV show tracking Android app, which connects to trakt.tv",2017-08-17T16:35:58Z,2023-10-25T04:35:28Z,2023-10-24T13:14:37Z,Kotlin,main,27,True
phpredis/phpredis,A PHP extension for Redis,2011-03-15T14:40:14Z,2023-10-25T04:24:53Z,2023-10-25T08:32:13Z,C,develop,1,True
yabwe/medium-editor,Medium.com WYSIWYG editor clone. Uses contenteditable API to implement a rich text solution.,2013-05-29T17:40:11Z,2023-10-25T10:31:13Z,2022-12-11T17:28:57Z,JavaScript,master,149,True
froala/design-blocks,A set of 170+ Bootstrap based design blocks ready to be used to create clean modern websites.,2017-08-03T13:22:43Z,2023-10-24T06:46:17Z,2022-06-22T05:08:03Z,HTML,dev,7,True
joho/godotenv,A Go port of Ruby's dotenv library (Loads environment variables from .env files),2013-07-30T07:45:19Z,2023-10-25T11:41:53Z,2023-09-05T09:53:30Z,Go,main,9,True
sj26/mailcatcher,Catches mail and serves it through a dream.,2010-10-25T01:29:06Z,2023-10-25T11:09:00Z,2023-09-18T02:13:37Z,Ruby,main,20,True
MarshallOfSound/Google-Play-Music-Desktop-Player-UNOFFICIAL-,A beautiful cross platform Desktop Player for Google Play Music,2015-07-31T14:05:23Z,2023-10-25T12:50:46Z,2023-01-04T14:30:16Z,JavaScript,master,55,True
mislav/will_paginate,Pagination library for Rails and other Ruby applications,2008-02-25T20:21:40Z,2023-10-24T23:46:00Z,2023-10-04T11:45:04Z,Ruby,master,21,True
jpillora/cloud-torrent,☁️ Cloud Torrent: a self-hosted remote torrent client,2015-05-31T04:48:16Z,2023-10-23T20:12:02Z,2022-03-01T10:06:54Z,Go,master,32,True
ntop/n2n,Peer-to-peer VPN,2016-10-23T08:42:16Z,2023-10-25T05:55:17Z,2023-10-24T10:20:13Z,C,dev,5,True
OnsenUI/OnsenUI,"Mobile app development framework and SDK using HTML5 and JavaScript. Create beautiful and performant cross-platform mobile apps. Based on Web Components, and provides bindings for Angular 1, 2, React and Vue.js.",2013-09-11T11:52:41Z,2023-10-25T03:45:28Z,2023-09-27T10:38:13Z,JavaScript,master,70,True
cmderdev/cmder,Lovely console emulator package for Windows,2013-07-09T07:44:22Z,2023-10-25T11:56:07Z,2023-10-25T09:02:46Z,C++,master,33,True
sivel/speedtest-cli,Command line interface for testing internet bandwidth using speedtest.net,2012-09-10T19:17:53Z,2023-10-25T07:51:34Z,2023-10-04T16:10:57Z,Python,master,22,True
summernote/summernote,Super simple WYSIWYG editor,2013-04-27T04:59:48Z,2023-10-25T10:37:30Z,2023-10-18T12:33:49Z,JavaScript,develop,60,True
symless/synergy-core,"Open source core of Synergy, the cross-platform keyboard and mouse sharing tool (Windows, macOS, Linux)",2014-10-12T23:18:57Z,2023-10-25T07:21:38Z,2023-09-29T07:48:35Z,C++,master,319,True
feathersjs/feathers,The API and real-time application framework,2011-10-19T22:45:16Z,2023-10-25T11:37:59Z,2023-10-13T17:37:51Z,TypeScript,dove,80,True
cayleygraph/cayley,An open-source graph database,2014-06-05T18:49:41Z,2023-10-24T14:22:02Z,2023-08-06T21:59:38Z,Go,master,15,True
go-swagger/go-swagger,Swagger 2.0 implementation for go,2014-11-16T20:13:15Z,2023-10-25T10:38:48Z,2023-10-24T22:41:04Z,Go,master,54,True
SeleniumHQ/docker-selenium,"Provides a simple way to run Selenium Grid with Chrome, Firefox, and Edge using Docker, making it easier to perform browser automation",2014-11-17T17:39:22Z,2023-10-25T11:20:56Z,2023-10-25T11:40:18Z,Shell,trunk,274,True
matryer/xbar,Put the output from any script or program into your macOS Menu Bar (the BitBar reboot),2013-11-13T21:00:12Z,2023-10-25T08:25:12Z,2023-10-11T21:05:13Z,Go,main,69,True
callmecavs/layzr.js,A modern lazy loading library for images.,2015-04-08T03:03:08Z,2023-10-22T10:02:10Z,2017-10-29T22:06:44Z,JavaScript,master,20,True
IanLunn/Hover,"A collection of CSS3 powered hover effects to be applied to links, buttons, logos, SVG, featured images and so on. Easily apply to your own elements, modify or just use for inspiration. Available in CSS, Sass, and LESS.",2014-01-02T14:27:35Z,2023-10-25T11:37:18Z,2023-06-04T08:16:27Z,SCSS,master,10,True
laravel/socialite,Laravel wrapper around OAuth 1 & OAuth 2 libraries.,2014-08-18T02:49:36Z,2023-10-23T05:52:05Z,2023-10-25T07:04:28Z,PHP,5.x,50,True
ShareX/ShareX,"ShareX is a free and open source program that lets you capture or record any area of your screen and share it with a single press of a key. It also allows uploading images, text or other types of files to many supported destinations you can choose from.",2013-10-08T23:32:10Z,2023-10-25T12:46:09Z,2023-10-24T11:16:57Z,C#,develop,76,True
google/filament,"Filament is a real-time physically based rendering engine for Android, iOS, Windows, Linux, macOS, and WebGL2",2018-08-03T17:26:00Z,2023-10-25T08:28:59Z,2023-10-25T04:56:44Z,C++,main,160,True
i-tu/Hasklig,Hasklig - a code font with monospaced ligatures,2014-04-06T11:10:28Z,2023-10-23T11:06:37Z,2022-02-19T01:25:54Z,Python,main,9,True
ninjaprox/NVActivityIndicatorView,A collection of awesome loading animations,2015-07-21T15:01:17Z,2023-10-25T02:43:52Z,2023-02-28T13:51:00Z,Swift,master,47,True
medialize/URI.js,Javascript URL mutation library,2011-12-27T10:46:47Z,2023-10-17T13:30:41Z,2023-08-27T10:51:22Z,JavaScript,gh-pages,43,True
nhn/tui.image-editor,"🍞🎨 Full-featured photo image editor using canvas. It is really easy, and it comes with great filters.",2016-04-28T01:50:33Z,2023-10-25T11:31:15Z,2023-10-08T06:43:47Z,JavaScript,master,38,True
ytisf/theZoo,A repository of LIVE malwares for your own joy and pleasure. theZoo is a project created to make the possibility of malware analysis open and available to the public.,2014-01-09T18:55:35Z,2023-10-25T12:11:13Z,2023-06-08T22:54:03Z,Python,master,2,True
alicevision/Meshroom,3D Reconstruction Software,2015-04-22T17:33:16Z,2023-10-25T12:18:41Z,2023-10-25T13:01:03Z,Python,develop,7,True
Laverna/laverna,Laverna is a JavaScript note taking application with Markdown editor and encryption support. Consider it like open source alternative to Evernote.,2014-01-21T08:24:17Z,2023-10-24T17:11:28Z,2021-05-30T22:18:41Z,JavaScript,master,21,True
robolectric/robolectric,Android Unit Testing Framework,2010-08-28T00:28:25Z,2023-10-25T09:01:59Z,2023-10-24T21:10:19Z,Java,master,96,True
leeoniya/uPlot,"📈 A small, fast chart for time series, lines, areas, ohlc & bars",2019-09-27T18:45:21Z,2023-10-25T00:03:50Z,2023-10-16T02:23:18Z,JavaScript,master,57,True
reduxjs/reselect,Selector library for Redux,2015-07-01T11:06:45Z,2023-10-25T03:06:00Z,2023-10-25T07:42:35Z,TypeScript,master,40,True
ShiqiYu/libfacedetection,An open source library for face detection in images. The face detection speed can reach 1000FPS. ,2015-01-20T07:47:20Z,2023-10-25T09:48:10Z,2023-08-01T09:55:36Z,C++,master,2,True
olivere/elastic,Deprecated: Use the official Elasticsearch client for Go at https://github.com/elastic/go-elasticsearch,2012-12-06T17:15:33Z,2023-10-25T05:07:55Z,2023-09-08T10:30:50Z,Go,release-branch.v7,35,True
ggerganov/whisper.cpp,Port of OpenAI's Whisper model in C/C++,2022-09-25T18:26:37Z,2023-10-25T12:08:16Z,2023-10-24T04:35:18Z,C,master,7,True
phoenixframework/phoenix,Peace of mind from prototype to production,2014-01-20T14:14:11Z,2023-10-25T05:01:03Z,2023-10-24T06:49:05Z,Elixir,main,20,True
cure53/DOMPurify,"DOMPurify - a DOM-only, super-fast, uber-tolerant XSS sanitizer for HTML, MathML and SVG. DOMPurify works with a secure default, but offers a lot of configurability and hooks. Demo:",2014-02-17T21:48:14Z,2023-10-25T12:33:05Z,2023-10-25T12:45:25Z,JavaScript,main,96,True
99designs/aws-vault,A vault for securely storing and accessing AWS credentials in development environments,2015-08-11T12:09:34Z,2023-10-25T08:42:31Z,2023-08-19T05:20:03Z,Go,master,78,True
flutter/flutter,Flutter makes it easy and fast to build beautiful apps for mobile and beyond,2015-03-06T22:54:58Z,2023-10-25T11:13:58Z,2023-10-25T12:15:30Z,Dart,master,4,True
Kong/insomnia,"The open-source, cross-platform API client for GraphQL, REST, WebSockets, SSE and gRPC. With Cloud, Local and Git storage.",2016-04-23T03:54:26Z,2023-10-25T12:33:28Z,2023-10-25T10:36:51Z,JavaScript,develop,388,True
ggerganov/kbd-audio,🎤⌨️ Acoustic keyboard eavesdropping,2018-08-27T17:19:02Z,2023-10-25T04:25:50Z,2023-01-15T07:48:08Z,C++,master,2,True
confluentinc/ksql,The database purpose-built for stream processing applications.,2016-09-27T21:30:15Z,2023-10-24T14:49:19Z,2023-10-25T12:23:14Z,Java,master,8,True
facebookresearch/mmf,A modular framework for vision & language multimodal research from Facebook AI Research (FAIR),2018-06-27T04:52:40Z,2023-10-24T11:38:10Z,2023-10-18T21:51:58Z,Python,main,2,True
wojtekmaj/react-pdf,Display PDFs in your React app as easily as if they were images.,2016-08-01T13:46:02Z,2023-10-25T08:47:32Z,2023-10-25T13:02:27Z,TypeScript,main,136,True
VirusTotal/yara,The pattern matching swiss knife,2012-12-06T15:33:08Z,2023-10-25T06:33:55Z,2023-10-24T08:13:52Z,C,master,41,True
infernojs/inferno,":fire: An extremely fast, React-like JavaScript library for building modern user interfaces",2015-02-01T22:07:38Z,2023-10-23T11:08:48Z,2023-10-22T19:17:57Z,JavaScript,master,185,True
microsoft/Bringing-Old-Photos-Back-to-Life,Bringing Old Photo Back to Life (CVPR 2020 oral),2020-06-24T06:37:58Z,2023-10-25T07:00:21Z,2023-10-23T06:45:00Z,Python,master,1,True
PhilJay/MPAndroidChart,"A powerful 🚀 Android chart view / graph view library, supporting line- bar- pie- radar- bubble- and candlestick charts as well as scaling, panning and animations.",2014-04-25T14:29:47Z,2023-10-25T09:01:39Z,2023-10-17T11:28:12Z,Java,master,44,True
Semantic-Org/Semantic-UI-React,The official Semantic-UI-React integration,2015-06-19T16:47:19Z,2023-10-25T10:40:38Z,2023-09-04T15:15:33Z,JavaScript,master,21,True
zadam/trilium,Build your personal knowledge base with Trilium Notes,2017-05-23T00:30:20Z,2023-10-25T11:09:24Z,2023-10-24T21:15:23Z,JavaScript,master,278,True
tiangolo/full-stack-fastapi-postgresql,"Full stack, modern web application generator. Using FastAPI, PostgreSQL as database, Docker, automatic HTTPS and more.",2019-02-23T15:08:34Z,2023-10-25T12:13:20Z,2023-10-04T13:30:45Z,Python,master,6,True
cssinjs/jss,JSS is an authoring tool for CSS which uses JavaScript as a host language.,2014-10-12T20:33:53Z,2023-10-25T07:29:49Z,2023-07-25T09:38:27Z,JavaScript,master,41,True
developit/microbundle,📦 Zero-configuration bundler for tiny modules.,2017-12-11T21:51:02Z,2023-10-25T11:11:12Z,2023-09-26T15:17:44Z,JavaScript,master,37,True
saltstack/salt,Software to automate the management and configuration of any infrastructure or application at scale. Get access to the Salt software package repository here: ,2011-02-20T20:16:56Z,2023-10-25T04:15:07Z,2023-10-25T09:39:44Z,Python,master,191,True
restic/restic,"Fast, secure, efficient backup program",2014-04-27T14:07:58Z,2023-10-25T10:23:47Z,2023-10-24T18:12:29Z,Go,master,39,True
celery/celery,Distributed Task Queue (development branch),2009-04-24T11:31:24Z,2023-10-25T11:57:39Z,2023-10-25T03:59:36Z,Python,main,43,True
gunthercox/ChatterBot,"ChatterBot is a machine learning, conversational dialog engine for creating chat bots",2014-09-28T14:49:00Z,2023-10-25T12:35:48Z,2023-10-06T03:06:58Z,Python,master,86,True
davidjbradshaw/iframe-resizer,"Keep same and cross domain iFrames sized to their content with support for window/content resizing, in page links, nesting and multiple iFrames",2013-06-14T19:18:32Z,2023-10-25T02:06:40Z,2023-10-23T22:34:39Z,JavaScript,master,47,True
shadowsocks/shadowsocks-android,A shadowsocks client for Android,2012-12-16T13:40:29Z,2023-10-25T10:02:55Z,2023-09-25T07:55:10Z,Kotlin,master,184,True
boto/boto3,AWS SDK for Python,2014-10-03T21:38:03Z,2023-10-24T20:41:59Z,2023-10-24T23:35:00Z,Python,develop,14,True
akiran/react-slick,React carousel component ,2014-11-16T05:14:39Z,2023-10-25T08:34:04Z,2023-10-01T11:01:06Z,JavaScript,master,40,True
BlackrockDigital/startbootstrap,A library of free and open source Bootstrap themes and templates,2013-08-10T00:05:36Z,2023-10-23T02:39:13Z,2020-10-12T20:57:37Z,HTML,master,2,True
miguelgrinberg/Flask-SocketIO,Socket.IO integration for Flask applications.,2014-02-09T07:22:50Z,2023-10-24T15:24:48Z,2023-10-15T13:28:44Z,Python,main,87,True
adobe-fonts/source-han-serif,Source Han Serif | 思源宋体 | 思源宋體 | 思源宋體 香港 | 源ノ明朝 | 본명조,2017-03-07T22:49:29Z,2023-10-25T12:44:06Z,2023-08-18T10:05:20Z,Shell,master,10,True
MrS0m30n3/youtube-dl-gui,A cross platform front-end GUI of the popular youtube-dl written in wxPython.,2014-03-01T17:11:10Z,2023-10-24T02:07:44Z,2022-12-06T17:12:44Z,Python,master,3,True
louthy/language-ext,C# functional language extensions - a base class library for functional programming,2014-11-16T23:49:58Z,2023-10-25T04:38:38Z,2023-10-21T15:22:00Z,C#,main,83,True
microsoft/react-native-code-push,React Native module for CodePush,2015-06-02T17:19:20Z,2023-10-24T10:55:42Z,2023-10-25T13:01:48Z,C,master,100,True
benoitc/gunicorn,"gunicorn 'Green Unicorn' is a WSGI HTTP Server for UNIX, fast clients and sleepy applications.",2009-11-30T18:18:08Z,2023-10-25T07:35:11Z,2023-10-23T20:58:55Z,Python,master,29,True
jonas/tig,Text-mode interface for git,2009-03-01T20:39:25Z,2023-10-25T08:57:17Z,2023-10-24T01:56:43Z,C,master,28,True
odeke-em/drive,Google Drive client for the commandline,2014-11-03T08:18:11Z,2023-10-24T06:38:49Z,2022-12-30T11:43:22Z,Go,master,53,True
emilk/egui,egui: an easy-to-use immediate mode GUI in Rust that runs on both web and native,2019-01-13T15:39:15Z,2023-10-25T11:33:58Z,2023-10-25T10:30:57Z,Rust,master,13,True
jonobr1/two.js,A renderer agnostic two-dimensional drawing api for the web.,2012-09-05T23:19:40Z,2023-10-25T03:38:06Z,2023-10-16T18:05:37Z,JavaScript,dev,29,True
reactiveui/refit,"The automatic type-safe REST library for .NET Core, Xamarin and .NET. Heavily inspired by Square's Retrofit library, Refit turns your REST API into a live interface.",2013-07-22T20:11:57Z,2023-10-25T05:19:12Z,2023-10-23T00:09:40Z,C#,main,58,True
primefaces/primeng,The Most Complete Angular UI Component Library,2016-01-16T09:23:28Z,2023-10-25T11:51:29Z,2023-10-25T11:58:23Z,CSS,master,234,True
microsoft/SandDance,"Visually explore, understand, and present your data.",2018-11-05T22:45:31Z,2023-10-23T11:04:58Z,2023-10-19T20:38:18Z,TypeScript,main,3,True
pagekit/pagekit,Pagekit CMS,2014-03-06T17:30:55Z,2023-10-22T23:09:39Z,2022-09-30T19:04:02Z,PHP,develop,35,True
python-pillow/Pillow,Python Imaging Library (Fork),2012-07-24T21:38:39Z,2023-10-25T11:16:58Z,2023-10-25T01:41:13Z,Python,main,53,True
photonstorm/phaser,"Phaser is a fun, free and fast 2D game framework for making HTML5 games for desktop and mobile web browsers, supporting Canvas and WebGL rendering.",2013-04-12T12:27:51Z,2023-10-25T08:59:40Z,2023-10-16T21:59:41Z,JavaScript,master,142,True
davemorrissey/subsampling-scale-image-view,"Android library (AAR). Highly configurable, easily extendable deep zoom view for displaying huge images without loss of detail. Perfect for photo galleries, maps, building plans etc.",2013-08-26T16:45:25Z,2023-10-25T01:36:49Z,2022-03-30T10:42:13Z,Java,master,21,True
libimobiledevice/libimobiledevice,A cross-platform protocol library to communicate with iOS devices,2013-02-13T14:33:15Z,2023-10-25T13:05:00Z,2023-10-06T23:52:12Z,C,master,2,True
appbaseio/dejavu,"The Missing Web UI for Elasticsearch: Import, browse and edit data with rich filters and query views, create search UIs visually.",2016-02-03T17:48:09Z,2023-10-25T01:14:58Z,2023-10-18T20:29:37Z,JavaScript,dev,59,True
digininja/DVWA,Damn Vulnerable Web Application (DVWA),2013-05-01T13:03:10Z,2023-10-25T09:11:07Z,2023-10-11T08:22:13Z,PHP,master,8,True
es-shims/es5-shim,ECMAScript 5 compatibility shims for legacy (and modern) JavaScript engines,2010-09-16T05:54:16Z,2023-10-23T03:37:29Z,2022-11-08T06:12:06Z,JavaScript,master,44,True
invertase/react-native-firebase,🔥 A well-tested feature-rich modular Firebase implementation for React Native. Supports both iOS & Android platforms for all Firebase services.,2017-02-01T12:01:03Z,2023-10-24T15:43:26Z,2023-10-25T02:04:12Z,JavaScript,main,83,True
nosir/cleave.js,Format input text content when you are typing...,2016-05-18T12:45:03Z,2023-10-24T09:22:31Z,2023-07-19T19:14:31Z,JavaScript,master,66,True
guzzle/guzzle,"Guzzle, an extensible PHP HTTP client",2011-02-28T02:44:05Z,2023-10-25T01:47:58Z,2023-10-21T09:03:25Z,PHP,7.8,61,True
pinterest/ktlint,An anti-bikeshedding Kotlin linter with built-in formatter,2016-07-27T09:03:52Z,2023-10-24T11:13:23Z,2023-10-21T20:53:20Z,Kotlin,master,91,True
sarcadass/granim.js,Create fluid and interactive gradient animations with this small javascript library.,2016-08-30T22:36:48Z,2023-10-25T03:31:40Z,2022-12-06T17:56:03Z,JavaScript,master,10,True
mozilla/DeepSpeech,"DeepSpeech is an open source embedded (offline, on-device) speech-to-text engine which can run in real time on devices ranging from a Raspberry Pi 4 to high power GPU servers.",2016-06-02T15:04:53Z,2023-10-25T12:24:18Z,2023-09-16T05:37:11Z,C++,master,105,True
sourcegraph/conc,Better structured concurrency for go,2023-01-02T22:52:07Z,2023-10-25T10:25:16Z,2023-10-11T03:39:05Z,Go,main,3,True
apache/mxnet,"Lightweight, Portable, Flexible Distributed/Mobile Deep Learning with Dynamic, Mutation-aware Dataflow Dep Scheduler; for Python, R, Julia, Scala, Go, Javascript and more",2015-04-30T16:21:15Z,2023-10-25T11:07:33Z,2023-10-11T20:37:58Z,C++,master,34,True
maurosoria/dirsearch,Web path scanner,2013-04-30T15:57:40Z,2023-10-25T11:31:42Z,2023-10-18T01:40:26Z,Python,master,16,True
jpbruinsslot/slack-term,Slack client for your terminal,2016-09-11T15:42:42Z,2023-10-23T20:00:17Z,2023-07-07T02:21:51Z,Go,master,13,True
hibiken/asynq,"Simple, reliable, and efficient distributed task queue in Go",2019-11-15T05:17:55Z,2023-10-25T12:43:20Z,2023-10-19T11:36:26Z,Go,master,29,True
yarnpkg/yarn,The 1.x line is frozen - features and bugfixes now happen on https://github.com/yarnpkg/berry,2016-01-19T17:39:16Z,2023-10-25T08:31:11Z,2023-09-07T11:42:28Z,JavaScript,master,150,True
nylas/nylas-mail,:love_letter: An extensible desktop mail app built on the modern web.  Forks welcome!,2014-10-16T18:29:12Z,2023-10-24T16:44:51Z,2022-11-24T08:20:57Z,JavaScript,master,53,True
lz4/lz4,Extremely Fast Compression algorithm,2014-03-25T15:52:21Z,2023-10-25T03:37:09Z,2023-10-24T16:23:47Z,C,dev,30,True
CocoaLumberjack/CocoaLumberjack,"A fast & simple, yet powerful & flexible logging framework for macOS, iOS, tvOS and watchOS",2011-03-31T02:38:39Z,2023-10-25T07:52:30Z,2023-10-18T10:07:53Z,Objective-C,master,48,True
Azure/azure-quickstart-templates,Azure Quickstart Templates,2015-04-22T18:19:03Z,2023-10-25T12:57:44Z,2023-10-24T17:16:15Z,Bicep,master,3,True
tonsky/FiraCode,Free monospaced font with programming ligatures,2014-11-11T19:32:38Z,2023-10-25T09:47:11Z,2023-06-19T17:28:31Z,Clojure,master,29,True
tidwall/tile38,Real-time Geospatial and Geofencing,2016-03-04T23:07:44Z,2023-10-24T15:21:25Z,2023-10-19T16:15:32Z,Go,master,86,True
