Repo,description,created_at,updated_at,pushed_at,language,default_branch,num release,has_rn
Sanster/lama-cleaner,"Image inpainting tool powered by SOTA AI Model. Remove any unwanted object, defect, people from your pictures or erase and replace(powered by stable diffusion) any thing on your pictures.",2021-11-15T14:16:40Z,2023-10-25T09:49:44Z,2023-10-09T14:28:38Z,Python,main,49,True
huggingface/pytorch-image-models,"PyTorch image models, scripts, pretrained weights -- ResNet, ResNeXT, EfficientNet, NFNet, Vision Transformer (ViT), MobileNet-V3/V2, RegNet, DPN, CSPNet, Swin Transformer, MaxViT, CoAtNet, ConvNeXt, and more",2019-02-02T05:51:12Z,2023-10-25T12:08:49Z,2023-10-23T12:47:52Z,Python,main,50,True
facebook/rocksdb,"A library that provides an embeddable, persistent key-value store for fast storage.",2012-11-30T06:16:18Z,2023-10-25T11:07:53Z,2023-10-25T11:38:20Z,C++,main,178,True
folke/lazy.nvim,💤 A modern plugin manager for Neovim,2022-11-20T21:36:02Z,2023-10-25T11:59:52Z,2023-10-23T14:00:10Z,Lua,main,131,True
containers/buildah,A tool that facilitates building OCI images.,2017-01-26T16:59:13Z,2023-10-25T01:19:16Z,2023-10-25T10:27:34Z,Go,main,128,True
firebase/flutterfire,🔥 A collection of Firebase plugins for Flutter apps.,2019-08-14T21:38:05Z,2023-10-25T08:34:51Z,2023-10-25T09:22:46Z,Dart,master,6,True
akveo/blur-admin,AngularJS Bootstrap Admin Panel Framework,2016-04-08T08:30:20Z,2023-10-23T11:14:02Z,2022-09-05T08:21:21Z,JavaScript,master,1,True
yuliskov/SmartTubeNext,SmartTube - an advanced player for set-top boxes and tv running Android OS,2020-07-28T12:53:52Z,2023-10-25T12:32:29Z,2023-10-25T01:34:39Z,Java,master,209,True
open-falcon/falcon-plus, An open-source and enterprise-level monitoring system.,2016-04-09T15:06:29Z,2023-10-23T11:14:04Z,2023-08-07T10:52:21Z,Go,master,3,True
sourcegraph/sourcegraph,Code AI platform with Code Search & Cody,2015-08-24T07:27:28Z,2023-10-25T07:16:38Z,2023-10-25T12:34:56Z,Go,main,66,True
dstotijn/hetty,An HTTP toolkit for security research.,2019-11-17T14:16:23Z,2023-10-25T12:01:59Z,2023-03-14T22:32:32Z,Go,main,12,True
typicode/husky,Git hooks made easy 🐶 woof!,2014-06-23T12:14:21Z,2023-10-25T08:49:07Z,2023-10-12T23:51:59Z,JavaScript,main,60,True
falconry/falcon,"The no-magic web data plane API and microservices framework for Python developers, with a focus on reliability, correctness, and performance at scale.",2012-12-06T18:17:51Z,2023-10-25T07:37:52Z,2023-10-17T17:02:30Z,Python,master,16,True
PyMySQL/PyMySQL,MySQL client library for Python,2011-07-27T17:38:47Z,2023-10-25T07:00:33Z,2023-09-14T21:55:03Z,Python,main,6,True
sqlmapproject/sqlmap,Automatic SQL injection and database takeover tool,2012-06-26T09:52:15Z,2023-10-25T12:37:09Z,2023-10-22T09:25:52Z,Python,master,8,True
gocd/gocd,Main repository for GoCD - Continuous Delivery server,2013-12-13T05:26:16Z,2023-10-25T08:51:47Z,2023-10-24T09:19:56Z,Java,master,76,True
bartobri/no-more-secrets,A command line tool that recreates the famous data decryption effect seen in the 1992 movie Sneakers.,2016-04-04T20:41:05Z,2023-10-25T12:20:31Z,2023-02-17T17:19:05Z,C,master,5,True
icsharpcode/ILSpy,".NET Decompiler with support for PDB generation, ReadyToRun, Metadata (&more) - cross-platform!",2011-02-04T11:24:20Z,2023-10-25T10:11:33Z,2023-10-24T02:39:59Z,C#,master,69,True
redis/redis-py,Redis Python Client,2009-11-06T10:22:26Z,2023-10-25T11:38:31Z,2023-10-24T08:23:09Z,Python,master,52,True
statsmodels/statsmodels,Statsmodels: statistical modeling and econometrics in Python,2011-06-12T17:04:50Z,2023-10-25T05:49:34Z,2023-10-22T15:00:59Z,Python,main,25,True
libgdx/libgdx,Desktop/Android/HTML5/iOS Java game development framework,2012-08-10T19:34:38Z,2023-10-25T09:42:53Z,2023-10-22T17:07:48Z,Java,master,10,True
influxdata/telegraf,The plugin-driven server agent for collecting & reporting metrics.,2015-04-01T16:28:44Z,2023-10-24T20:55:03Z,2023-10-25T10:18:37Z,Go,master,166,True
gogs/gogs,Gogs is a painless self-hosted Git service,2014-02-12T01:57:08Z,2023-10-25T12:35:19Z,2023-10-21T00:26:54Z,Go,main,78,True
Nickersoft/push.js,The world's most versatile desktop notifications framework :earth_americas:,2015-07-20T01:46:04Z,2023-10-23T11:10:31Z,2023-01-03T21:04:38Z,JavaScript,master,21,True
kaminari/kaminari,"⚡ A Scope & Engine based, clean, powerful, customizable and sophisticated paginator for Ruby webapps",2011-02-06T08:07:20Z,2023-10-24T14:25:23Z,2023-10-16T15:58:55Z,Ruby,master,52,True
pagekit/vue-resource,The HTTP client for Vue.js,2014-02-07T23:07:56Z,2023-10-24T05:03:06Z,2022-12-08T21:37:18Z,JavaScript,develop,53,True
buger/jsonparser,One of the fastest alternative JSON parser for Go that does not require schema,2016-03-20T06:22:33Z,2023-10-25T09:09:21Z,2023-10-17T16:46:43Z,Go,master,3,True
wbkd/react-flow,"Highly customizable library for building an interactive node-based UI, workflow editor, flow chart or static diagram ",2019-07-15T14:47:30Z,2023-10-25T11:58:40Z,2023-10-25T07:34:15Z,TypeScript,main,227,True
dessant/buster,"Captcha solver extension for humans, available for Chrome, Edge and Firefox",2018-11-18T08:31:52Z,2023-10-25T01:29:23Z,2023-07-30T10:06:46Z,JavaScript,main,18,True
bazelbuild/bazel,"a fast, scalable, multi-language and extensible build system",2014-06-12T16:00:38Z,2023-10-25T09:00:13Z,2023-10-25T12:12:30Z,Java,master,230,True
prometheus/node_exporter,Exporter for machine metrics,2013-04-18T14:44:52Z,2023-10-25T12:32:33Z,2023-10-25T03:24:57Z,Go,master,45,True
tbruyelle/RxPermissions,Android runtime permissions powered by RxJava2,2015-09-29T13:55:09Z,2023-10-25T02:55:00Z,2022-05-11T09:47:47Z,Java,master,11,True
metafizzy/zdog,"Flat, round, designer-friendly pseudo-3D engine for canvas & SVG",2019-03-06T14:52:39Z,2023-10-25T11:04:39Z,2023-07-18T21:43:53Z,JavaScript,master,5,True
jaredreich/notie,"🔔 a clean and simple notification, input, and selection suite for javascript, with no dependencies",2015-11-06T03:08:02Z,2023-10-19T09:02:12Z,2023-05-04T13:18:42Z,JavaScript,master,8,True
pa7/heatmap.js,🔥 JavaScript Library for HTML5 canvas based heatmaps,2011-04-22T00:25:04Z,2023-10-23T11:02:34Z,2023-09-03T12:39:57Z,JavaScript,master,3,True
uber/react-vis,Data Visualization Components,2016-02-22T20:45:50Z,2023-10-24T16:22:50Z,2023-06-08T04:34:14Z,JavaScript,master,59,True
openzfs/zfs,OpenZFS on Linux and FreeBSD,2009-12-14T20:20:34Z,2023-10-25T12:11:13Z,2023-10-25T11:45:51Z,C,master,95,True
audacity/audacity,Audio Editor                                     ,2015-03-26T10:46:17Z,2023-10-25T07:47:34Z,2023-10-25T08:28:37Z,C,master,39,True
charliermarsh/ruff,"An extremely fast Python linter and code formatter, written in Rust.",2022-08-09T17:17:44Z,2023-10-25T12:40:17Z,2023-10-25T12:22:32Z,Rust,main,275,True
aws/aws-sam-cli,"CLI tool to build, test, debug, and deploy Serverless applications using AWS SAM",2017-05-23T18:16:23Z,2023-10-25T01:37:08Z,2023-10-25T10:53:13Z,Python,develop,184,True
FormidableLabs/spectacle,A React-based library for creating sleek presentations using JSX syntax that gives you the ability to live demo your code.,2015-06-30T20:36:07Z,2023-10-24T23:12:22Z,2023-09-12T12:29:02Z,TypeScript,main,62,True
shadowsocks/shadowsocks-rust,A Rust port of shadowsocks,2014-10-15T11:02:36Z,2023-10-25T05:12:43Z,2023-10-23T15:20:07Z,Rust,master,130,True
gwuhaolin/livego,live video streaming server in golang,2017-05-28T08:11:36Z,2023-10-25T07:22:20Z,2023-10-19T13:30:31Z,Go,master,12,True
ionic-team/stencil,"A toolchain for building scalable, enterprise-ready component systems on top of TypeScript and Web Component standards. Stencil components can be distributed natively to React, Angular, Vue, and traditional web developers from a single, framework-agnostic codebase.",2017-02-15T18:57:07Z,2023-10-25T09:24:53Z,2023-10-25T12:06:36Z,TypeScript,main,130,True
linuxserver/Heimdall,An Application dashboard and launcher,2018-01-26T12:04:05Z,2023-10-25T03:36:53Z,2023-10-20T08:25:34Z,PHP,2.x,74,True
denisidoro/navi,An interactive cheatsheet tool for the command-line,2019-09-20T13:38:20Z,2023-10-25T05:59:59Z,2023-10-18T05:11:14Z,Rust,master,66,True
spatie/laravel-permission,Associate users with roles and permissions,2015-09-14T22:19:38Z,2023-10-25T11:51:54Z,2023-10-25T06:53:43Z,PHP,main,181,True
Blankj/AndroidUtilCode,:fire: Android developers should collect the following utils(updating).,2016-07-30T18:18:32Z,2023-10-25T02:55:33Z,2023-05-22T01:52:08Z,Java,master,117,True
zsh-users/antigen,The plugin manager for zsh.,2012-05-25T12:57:01Z,2023-10-25T10:43:41Z,2023-07-27T06:25:19Z,Shell,develop,28,True
google/automl,Google Brain AutoML,2020-03-12T03:52:47Z,2023-10-24T18:06:38Z,2023-08-09T22:59:26Z,Jupyter Notebook,master,3,True
lmenezes/cerebro,,2016-03-23T13:05:09Z,2023-10-23T11:13:45Z,2023-10-07T04:53:17Z,JavaScript,main,33,True
libretro/RetroArch,"Cross-platform, sophisticated frontend for the libretro API. Licensed GPLv3.",2010-05-27T14:47:40Z,2023-10-25T12:20:13Z,2023-10-25T00:11:32Z,C,master,73,True
kubernetes/minikube,Run Kubernetes locally,2016-04-15T22:38:35Z,2023-10-25T07:20:07Z,2023-10-25T10:25:10Z,Go,master,143,True
grpc/grpc-web,gRPC for Web Clients,2016-06-20T17:34:33Z,2023-10-25T06:14:15Z,2023-10-16T21:35:11Z,JavaScript,master,19,True
browserify/browserify,browser-side require() the node.js way,2010-09-22T16:11:32Z,2023-10-23T11:02:10Z,2023-10-21T07:13:16Z,JavaScript,master,14,True
nolimits4web/swiper,Most modern mobile touch slider with hardware accelerated transitions,2012-03-14T19:11:45Z,2023-10-25T12:35:56Z,2023-10-25T08:33:04Z,JavaScript,master,57,True
WongKinYiu/yolov7,Implementation of paper - YOLOv7: Trainable bag-of-freebies sets new state-of-the-art for real-time object detectors,2022-07-06T15:14:06Z,2023-10-25T08:13:59Z,2023-10-23T21:35:32Z,Jupyter Notebook,main,1,True
rack/rack-attack,Rack middleware for blocking & throttling,2012-07-29T02:19:18Z,2023-10-24T15:04:16Z,2023-10-24T22:15:44Z,Ruby,main,24,True
carson-katri/dream-textures,Stable Diffusion built-in to Blender,2022-09-08T17:53:16Z,2023-10-25T08:23:45Z,2023-10-22T22:52:51Z,Python,main,11,True
3b1b/manim,Animation engine for explanatory math videos,2015-03-22T18:50:58Z,2023-10-25T11:18:53Z,2023-10-03T10:12:48Z,Python,master,10,True
ecomfe/vue-echarts,Apache ECharts component for Vue.js.,2016-06-17T09:55:24Z,2023-10-25T08:16:43Z,2023-10-06T02:00:07Z,JavaScript,main,15,True
adobe-fonts/source-code-pro,Monospaced font family for user interface and coding environments,2012-08-09T23:14:02Z,2023-10-25T05:26:58Z,2023-10-18T07:15:40Z,CSS,release,14,True
PyGithub/PyGithub,Typed interactions with the GitHub API v3,2012-02-25T12:53:47Z,2023-10-25T07:45:38Z,2023-10-23T14:13:54Z,Python,main,42,True
less/less.js,Less. The dynamic stylesheet language.,2010-02-20T17:25:38Z,2023-10-24T14:02:28Z,2023-10-22T19:04:41Z,JavaScript,master,35,True
lwouis/alt-tab-macos,Windows alt-tab on macOS ,2019-08-14T13:11:57Z,2023-10-25T09:36:16Z,2023-10-24T21:47:56Z,Swift,master,246,True
microsoft/playwright-python,Python version of the Playwright testing and automation library.,2020-07-01T15:28:13Z,2023-10-25T08:55:47Z,2023-10-24T23:00:21Z,Python,main,79,True
uber/kraken,P2P Docker registry capable of distributing TBs of data in seconds,2018-12-06T06:04:35Z,2023-10-24T11:15:53Z,2023-09-27T16:27:54Z,Go,master,5,True
naver/billboard.js," 📊 Re-usable, easy interface JavaScript chart library based on D3.js",2017-06-08T02:54:44Z,2023-10-25T06:38:51Z,2023-10-25T06:45:07Z,TypeScript,master,161,True
swagger-api/swagger-codegen,"swagger-codegen contains a template-driven engine to generate documentation, API clients and server stubs in different languages by parsing your OpenAPI / Swagger definition.",2011-07-06T14:26:48Z,2023-10-25T04:23:26Z,2023-10-23T12:27:58Z,Mustache,master,102,True
google/error-prone,Catch common Java mistakes as compile-time errors,2014-08-21T23:26:50Z,2023-10-23T14:08:48Z,2023-10-25T10:25:14Z,Java,master,33,True
sammchardy/python-binance,Binance Exchange API python implementation for automated trading,2017-08-14T12:09:45Z,2023-10-24T16:01:26Z,2023-10-19T10:04:40Z,Python,master,7,True
vercel/swr,React Hooks for Data Fetching,2019-10-28T18:16:01Z,2023-10-25T10:20:27Z,2023-10-18T07:20:13Z,TypeScript,main,110,True
openai/openai-python,The official Python library for the OpenAI API,2020-10-25T23:23:54Z,2023-10-25T12:25:40Z,2023-10-24T18:32:50Z,Python,main,61,True
marko-js/marko,"A declarative, HTML-based language that makes building web apps fun",2014-01-07T23:58:21Z,2023-10-25T10:14:03Z,2023-10-24T20:57:33Z,JavaScript,main,196,True
rofl0r/proxychains-ng,"proxychains ng (new generation) - a preloader which hooks calls to sockets in dynamically linked programs and redirects it through one or more socks/http proxies. continuation of the unmaintained proxychains project. the sf.net page is currently not updated, use releases from github release page instead.",2011-09-03T22:54:51Z,2023-10-25T10:20:22Z,2023-10-06T11:36:00Z,C,master,17,True
zetbaitsu/Compressor,An android image compression library.,2016-06-18T13:54:59Z,2023-10-25T03:50:11Z,2022-08-25T12:06:12Z,Kotlin,master,3,True
sachinchoolur/lightgallery.js,Full featured JavaScript image & video gallery. No dependencies,2016-08-01T04:19:56Z,2023-10-23T11:16:24Z,2023-10-10T05:17:49Z,JavaScript,master,17,True
vueuse/vueuse,Collection of essential Vue Composition Utilities for Vue 2 and 3,2019-12-14T06:44:59Z,2023-10-25T10:26:38Z,2023-10-25T07:52:38Z,TypeScript,main,265,True
thu-ml/tianshou,An elegant PyTorch deep reinforcement learning library.,2018-04-16T22:47:38Z,2023-10-25T12:42:03Z,2023-10-24T14:27:47Z,Python,master,27,True
facebook/react-native,A framework for building native applications using React,2015-01-09T18:10:16Z,2023-10-25T12:40:45Z,2023-10-25T11:57:41Z,Java,main,281,True
mxcl/PromiseKit,Promises for Swift & ObjC.,2014-04-04T13:54:37Z,2023-10-25T02:37:19Z,2023-08-27T15:12:22Z,Swift,master,81,True
vercel/commerce,Next.js Commerce,2020-10-26T22:30:00Z,2023-10-25T12:28:04Z,2023-10-23T16:41:18Z,TypeScript,main,1,True
sharkdp/hexyl,A command-line hex viewer,2018-11-05T22:53:35Z,2023-10-25T12:26:07Z,2023-09-23T19:49:32Z,Rust,master,15,True
codelucas/newspaper,"News, full-text, and article metadata extraction in Python 3. Advanced docs:",2013-11-25T09:50:50Z,2023-10-25T04:15:23Z,2023-10-03T12:53:13Z,Python,master,2,True
akveo/nebular,:boom: Customizable Angular UI Library based on Eva Design System :new_moon_with_face::sparkles:Dark Mode,2017-09-20T08:33:06Z,2023-10-25T12:24:26Z,2023-10-22T04:52:44Z,TypeScript,master,63,True
Yalantis/Side-Menu.Android,Side menu with some categories to choose.,2015-01-13T11:11:27Z,2023-10-25T02:56:34Z,2020-08-08T20:17:09Z,Java,master,2,True
syl20bnr/spacemacs,"A community-driven Emacs distribution - The best editor is neither Emacs nor Vim,  it's Emacs *and* Vim!",2012-12-17T21:34:03Z,2023-10-25T12:05:33Z,2023-10-23T06:48:11Z,Emacs Lisp,develop,158,True
google/dopamine,Dopamine is a research framework for fast prototyping of reinforcement learning algorithms. ,2018-07-26T09:58:36Z,2023-10-25T04:29:21Z,2023-10-22T05:03:59Z,Jupyter Notebook,master,2,True
coturn/coturn,coturn TURN server project,2015-07-17T08:15:16Z,2023-10-25T08:58:19Z,2023-10-25T07:54:12Z,C,master,35,True
apache/jmeter,Apache JMeter open-source load testing tool for analyzing and measuring the performance of a variety of services,2010-05-26T23:38:07Z,2023-10-25T02:29:28Z,2023-10-08T10:49:29Z,Java,master,8,True
gorilla/mux,Package gorilla/mux is a powerful HTTP router and URL matcher for building Go web servers with 🦍,2012-10-02T21:32:24Z,2023-10-25T08:35:49Z,2023-10-18T11:23:01Z,Go,main,14,True
mltframework/shotcut,"cross-platform (Qt), open-source (GPLv3) video editor",2012-04-23T22:37:04Z,2023-10-25T12:29:58Z,2023-10-25T01:55:36Z,C++,master,150,True
SeleniumHQ/selenium,A browser automation framework and ecosystem.,2013-01-14T21:40:56Z,2023-10-25T11:21:52Z,2023-10-25T12:41:32Z,Java,trunk,87,True
olton/Metro-UI-CSS,Impressive component library for expressive web development! Build responsive projects on the web with the first front-end component library in Metro Style. And now there are even more opportunities every day!,2012-03-09T13:54:28Z,2023-10-23T18:14:56Z,2023-10-22T09:50:54Z,CSS,4.5.2,121,True
aws/serverless-application-model,The AWS Serverless Application Model (AWS SAM) transform is a AWS CloudFormation macro that transforms SAM templates into CloudFormation templates.,2016-10-10T21:36:18Z,2023-10-25T01:36:53Z,2023-10-25T00:28:40Z,Python,develop,87,True
jaredpalmer/formik,"Build forms in React, without the tears 😭 ",2017-06-14T19:50:59Z,2023-10-25T11:44:23Z,2023-10-18T19:19:58Z,TypeScript,main,194,True
arachnys/cabot,"Self-hosted, easily-deployable monitoring and alerts service - like a lightweight PagerDuty",2014-01-06T17:48:59Z,2023-10-23T19:25:11Z,2023-09-10T09:23:26Z,JavaScript,master,22,True
ntop/ntopng,Web-based Traffic and Security Network Traffic Monitoring,2015-04-30T10:07:16Z,2023-10-24T13:16:25Z,2023-10-25T11:41:57Z,Lua,dev,14,True
microsoft/vscode,Visual Studio Code,2015-09-03T20:23:38Z,2023-10-25T11:54:57Z,2023-10-25T12:37:03Z,TypeScript,main,115,True
iview/iview,A high quality UI Toolkit built on Vue.js 2.0,2016-07-28T01:52:59Z,2023-10-25T02:09:17Z,2022-12-08T18:18:10Z,Vue,2.0,85,True
JetBrains/JetBrainsMono,JetBrains Mono – the free and open-source typeface for developers,2019-03-01T14:23:25Z,2023-10-25T12:36:25Z,2023-10-02T23:51:01Z,Shell,master,16,True
mitmproxy/mitmproxy,An interactive TLS-capable intercepting HTTP proxy for penetration testers and software developers.,2010-02-16T04:10:13Z,2023-10-25T12:39:56Z,2023-10-19T21:27:22Z,Python,main,51,True
hibernate/hibernate-orm,Hibernate's core Object/Relational Mapping functionality,2010-10-04T16:15:52Z,2023-10-24T18:01:34Z,2023-10-25T10:35:19Z,Java,main,19,True
FreeRDP/FreeRDP,FreeRDP is a free remote desktop protocol library and clients,2011-06-30T19:14:15Z,2023-10-25T12:21:41Z,2023-10-25T12:01:37Z,C,master,36,True
Swinject/Swinject,Dependency injection framework for Swift with iOS/macOS/Linux,2015-08-04T06:31:13Z,2023-10-25T11:49:41Z,2023-10-09T12:31:13Z,Swift,master,41,True
clips/pattern,"Web mining module for Python, with tools for scraping, natural language processing, machine learning, network analysis and visualization.",2011-05-03T15:29:01Z,2023-10-23T13:21:12Z,2023-07-12T09:12:48Z,Python,master,1,True
serde-rs/serde,Serialization framework for Rust,2013-11-13T15:22:58Z,2023-10-25T11:28:05Z,2023-10-25T05:32:59Z,Rust,master,282,True
traefik/traefik,The Cloud Native Application Proxy,2015-09-13T19:04:02Z,2023-10-25T11:52:39Z,2023-10-25T08:01:24Z,Go,master,399,True
ahmetb/kubectx,Faster way to switch between clusters and namespaces in kubectl,2017-03-30T18:06:53Z,2023-10-25T08:10:29Z,2023-08-04T22:04:50Z,Go,master,21,True
encode/httpx,A next generation HTTP client for Python. 🦋,2019-04-04T12:27:00Z,2023-10-25T05:18:21Z,2023-10-25T10:31:22Z,Python,master,43,True
wangyu-/udp2raw,"A Tunnel which Turns UDP Traffic into Encrypted UDP/FakeTCP/ICMP Traffic by using Raw Socket,helps you Bypass UDP FireWalls(or Unstable UDP Environment)",2017-08-04T04:15:38Z,2023-10-25T00:50:22Z,2023-10-08T03:39:24Z,C++,unified,33,True
mholt/PapaParse,Fast and powerful CSV (delimited text) parser that gracefully handles large files and malformed input,2013-10-07T20:33:21Z,2023-10-25T01:21:14Z,2023-10-09T14:14:28Z,JavaScript,master,16,True
jedisct1/libsodium,"A modern, portable, easy to use crypto library.",2013-01-20T00:03:40Z,2023-10-24T22:27:58Z,2023-10-22T01:18:01Z,C,master,33,True
ocornut/imgui,Dear ImGui: Bloat-free Graphical User interface for C++ with minimal dependencies,2014-07-21T14:29:47Z,2023-10-25T09:59:11Z,2023-10-20T15:56:58Z,C++,master,89,True
SocketCluster/socketcluster,Highly scalable realtime pub/sub and RPC framework,2013-09-23T12:11:47Z,2023-10-24T13:18:00Z,2023-10-20T17:09:16Z,JavaScript,master,44,True
spotify/annoy,Approximate Nearest Neighbors in C++/Python optimized for memory usage and loading/saving to disk,2013-04-01T20:29:40Z,2023-10-25T09:11:14Z,2023-08-20T17:38:53Z,C++,main,20,True
buger/goreplay,"GoReplay is an open-source tool for capturing and replaying live HTTP traffic into a test environment in order to continuously test your system with real data. It can be used to increase confidence in code deployments, configuration changes and infrastructure changes.",2013-05-30T09:29:07Z,2023-10-25T10:58:23Z,2023-09-21T09:20:52Z,Go,master,44,True
fluent/fluentd,Fluentd: Unified Logging Layer (project under CNCF),2011-06-19T08:41:40Z,2023-10-24T14:02:49Z,2023-10-25T08:59:03Z,Ruby,master,9,True
vercel/turbo,"Incremental bundler and build system optimized for JavaScript and TypeScript, written in Rust – including Turbopack and Turborepo.",2021-10-05T17:37:11Z,2023-10-25T12:14:01Z,2023-10-25T08:43:01Z,Rust,main,279,True
joeldev/JLRoutes,URL routing library for iOS with a simple block-based API,2013-02-10T23:09:45Z,2023-10-17T06:52:37Z,2023-02-21T14:37:00Z,Objective-C,master,20,True
plotly/plotly.py,The interactive graphing library for Python :sparkles: This project now includes Plotly Express!,2013-11-21T05:53:08Z,2023-10-24T15:08:59Z,2023-10-20T21:15:40Z,Python,master,79,True
ArthurHub/Android-Image-Cropper,"Image Cropping Library for Android, optimized for Camera / Gallery.",2015-01-15T10:49:37Z,2023-10-25T10:21:15Z,2023-09-17T15:20:18Z,Java,master,32,True
OctoPrint/OctoPrint,OctoPrint is the snappy web interface for your 3D printer!,2012-12-31T12:20:57Z,2023-10-25T12:05:15Z,2023-10-24T19:01:38Z,Python,master,138,True
twitchtv/twirp,A simple RPC framework with protobuf service definitions,2018-01-16T16:37:30Z,2023-10-25T05:36:28Z,2023-09-03T16:01:18Z,Go,main,29,True
elastic/logstash,"Logstash - transport and process your logs, events, or other data",2010-11-18T01:31:50Z,2023-10-25T09:15:40Z,2023-10-25T12:34:21Z,Java,main,126,True
akveo/react-native-ui-kitten,:boom: React Native UI Library based on Eva Design System  :new_moon_with_face::sparkles:Dark Mode,2016-12-20T08:22:38Z,2023-10-24T11:08:26Z,2023-09-27T20:41:13Z,TypeScript,master,31,True
hrydgard/ppsspp,"A PSP emulator for Android, Windows, Mac and Linux, written in C++. Want to contribute? Join us on Discord at https://discord.gg/5NJB6dD or just send pull requests / issues. For discussion use the forums at forums.ppsspp.org.",2012-11-01T08:41:48Z,2023-10-25T12:24:15Z,2023-10-24T21:40:18Z,C++,master,67,True
WordPress/gutenberg,The Block Editor project for WordPress and beyond. Plugin is available from the official repository.,2017-02-03T19:34:19Z,2023-10-25T07:42:36Z,2023-10-25T12:39:58Z,JavaScript,trunk,429,True
PanJiaChen/vue-element-admin,:tada: A magical vue admin                                                                https://panjiachen.github.io/vue-element-admin,2017-04-17T03:35:49Z,2023-10-25T12:44:41Z,2023-09-30T16:26:07Z,Vue,master,49,True
uutils/coreutils,Cross-platform Rust rewrite of the GNU coreutils,2013-08-02T16:22:56Z,2023-10-25T08:39:18Z,2023-10-25T11:34:45Z,Rust,main,21,True
mapbox/mapbox-gl-js,"Interactive, thoroughly customizable maps in the browser, powered by vector tiles and WebGL",2013-03-07T14:45:24Z,2023-10-25T09:42:28Z,2023-10-24T20:04:16Z,JavaScript,main,204,True
hiloteam/Hilo,A Cross-end HTML5 Game development solution developed by Alibaba Group,2015-07-06T07:11:41Z,2023-10-23T13:24:11Z,2022-06-29T02:45:43Z,JavaScript,dev,26,True
Unitech/pm2,Node.js Production Process Manager with a built-in Load Balancer.,2013-05-21T03:25:25Z,2023-10-25T08:46:59Z,2023-10-07T00:46:45Z,JavaScript,master,120,True
antlr/antlr4,"ANTLR (ANother Tool for Language Recognition) is a powerful parser generator for reading, processing, executing, or translating structured text or binary files.",2010-02-04T01:36:28Z,2023-10-25T03:11:03Z,2023-10-23T11:34:43Z,Java,dev,30,True
react-toolbox/react-toolbox,A set of React components implementing Google's Material Design specification with the power of CSS Modules,2015-05-27T15:23:33Z,2023-10-23T11:09:54Z,2021-12-28T08:27:27Z,JavaScript,dev,13,True
recharts/recharts,Redefined chart library built with React and D3,2015-08-07T06:50:27Z,2023-10-25T12:06:29Z,2023-10-25T10:40:04Z,TypeScript,master,30,True
Raathigesh/majestic,⚡ Zero config GUI for Jest,2017-11-28T10:28:30Z,2023-10-24T15:27:57Z,2022-05-03T14:54:05Z,TypeScript,master,11,True
neovim/neovim,Vim-fork focused on extensibility and usability,2014-01-31T13:39:22Z,2023-10-25T11:19:06Z,2023-10-25T12:40:32Z,Vim Script,master,35,True
gohugoio/hugo,The world’s fastest framework for building websites.,2013-07-04T15:26:26Z,2023-10-25T11:11:32Z,2023-10-25T08:53:43Z,Go,master,241,True
sghall/react-move,"React Move | Beautiful, data-driven animations for React",2017-03-20T15:38:13Z,2023-10-25T04:05:35Z,2023-01-07T03:56:01Z,JavaScript,master,22,True
jwagner/smartcrop.js,Content aware image cropping,2014-04-03T14:21:19Z,2023-10-23T11:06:36Z,2023-02-07T08:42:08Z,JavaScript,main,6,True
zylo117/Yet-Another-EfficientDet-Pytorch,The pytorch re-implement of the official efficientdet with SOTA performance in real time and pretrained weights.,2020-04-06T03:27:06Z,2023-10-25T12:25:11Z,2021-10-24T02:13:31Z,Jupyter Notebook,master,4,True
lightbend/config,configuration library for JVM languages using HOCON files,2011-12-06T08:02:29Z,2023-10-25T08:05:07Z,2023-10-17T11:31:56Z,Java,main,1,True
derailed/k9s,🐶 Kubernetes CLI To Manage Your Clusters In Style!,2019-01-25T18:46:02Z,2023-10-25T10:44:25Z,2023-10-25T08:37:31Z,Go,master,195,True
Dreamacro/clash,A rule-based tunnel in Go.,2018-06-10T14:28:14Z,2023-10-25T12:15:39Z,2023-10-24T03:07:40Z,Go,master,55,True
google/wire,Compile-time Dependency Injection for Go,2018-11-28T17:34:51Z,2023-10-25T10:22:29Z,2023-09-26T21:06:21Z,Go,main,6,True
coryhouse/react-slingshot,"React + Redux starter kit / boilerplate with Babel, hot reloading, testing, linting and a working example app built in",2015-12-31T22:04:53Z,2023-10-23T11:12:28Z,2023-09-26T00:25:23Z,JavaScript,master,13,True
