Repo,description,created_at,updated_at,pushed_at,language,default_branch,num release
eclipse/che,Kubernetes based Cloud Development Environments for Enterprise Teams,2015-03-26T15:31:01Z,2023-10-11T01:18:07Z,2023-10-11T14:48:01Z,TypeScript,main,76
facebook/rocksdb,"A library that provides an embeddable, persistent key-value store for fast storage.",2012-11-30T06:16:18Z,2023-10-12T02:28:37Z,2023-10-12T04:46:43Z,C++,main,178
octobercms/october,Self-hosted CMS platform based on the Laravel PHP Framework.,2013-11-26T23:30:43Z,2023-10-11T06:52:03Z,2023-10-05T08:30:35Z,PHP,3.x,9
soimort/you-get,:arrow_double_down: Dumb downloader that scrapes the web,2012-08-20T15:53:36Z,2023-10-12T05:10:34Z,2023-08-03T15:10:18Z,Python,develop,118
AudioKit/AudioKit,"Audio synthesis, processing, & analysis platform for iOS, macOS and tvOS",2014-01-21T08:16:07Z,2023-10-11T07:10:59Z,2023-10-02T16:40:05Z,Swift,main,82
ether/etherpad-lite,Etherpad: A modern really-real-time collaborative document editor.,2011-03-26T13:09:02Z,2023-10-12T04:44:38Z,2023-10-11T15:55:32Z,JavaScript,develop,42
klzgrad/naiveproxy,Make a fortune quietly,2018-01-27T16:02:33Z,2023-10-12T03:01:24Z,2023-09-21T23:24:45Z,C++,master,97
valinet/ExplorerPatcher,This project aims to enhance the working environment on Windows,2021-08-09T14:17:24Z,2023-10-12T05:14:51Z,2023-10-11T08:43:08Z,C,master,239
micro/micro,API first development platform,2015-01-16T22:35:14Z,2023-10-11T07:16:41Z,2023-10-11T22:31:35Z,Go,master,134
hashicorp/raft,Golang implementation of the Raft consensus protocol,2013-11-05T00:41:20Z,2023-10-12T02:26:15Z,2023-10-10T14:10:26Z,Go,main,20
go-swagger/go-swagger,Swagger 2.0 implementation for go,2014-11-16T20:13:15Z,2023-10-11T03:53:41Z,2023-10-04T08:18:51Z,Go,master,54
hql287/Manta,🎉 Flexible invoicing desktop app with beautiful & customizable templates.,2017-11-13T18:18:40Z,2023-10-09T14:22:31Z,2023-01-04T14:30:25Z,JavaScript,dev,6
knadh/listmonk,"High performance, self-hosted, newsletter and mailing list manager with a modern dashboard. Single binary app.",2019-06-26T05:08:39Z,2023-10-11T08:22:22Z,2023-10-11T23:40:25Z,Go,master,28
i-tu/Hasklig,Hasklig - a code font with monospaced ligatures,2014-04-06T11:10:28Z,2023-10-11T15:53:57Z,2022-02-19T01:25:54Z,Python,main,9
flarum/flarum,Simple forum software for building great communities.,2014-12-30T11:13:08Z,2023-10-11T12:36:06Z,2023-05-20T18:24:59Z,PHP,master,23
Netflix/zuul,"Zuul is a gateway service that provides dynamic routing, monitoring, resiliency, security, and more.",2013-03-13T18:53:57Z,2023-10-12T03:18:44Z,2023-10-11T16:28:12Z,Java,master,5
google/re2,"RE2 is a fast, safe, thread-friendly alternative to backtracking regular expression engines like those used in PCRE, Perl, and Python. It is a C++ library.",2014-08-18T21:21:26Z,2023-10-12T03:03:00Z,2023-10-10T20:44:42Z,C++,main,54
doctrine/collections,Collections Abstraction Library,2013-01-12T16:37:17Z,2023-10-10T12:48:38Z,2023-10-03T20:27:25Z,PHP,2.1.x,25
jquery/jquery-ui,The official jQuery user interface library.,2010-01-19T14:40:34Z,2023-10-12T01:50:56Z,2023-10-04T15:09:58Z,JavaScript,main,3
MichaelMure/git-bug,"Distributed, offline-first bug tracker embedded in git, with bridges",2018-07-12T07:55:57Z,2023-10-10T10:54:07Z,2023-10-11T23:04:43Z,Go,master,10
sheerun/vim-polyglot,A solid language pack for Vim.,2013-09-12T14:18:54Z,2023-10-11T20:37:45Z,2023-10-10T22:17:41Z,Vim Script,master,58
seanmonstar/warp,"A super-easy, composable, web server framework for warp speeds.",2018-07-11T17:43:50Z,2023-10-12T03:30:56Z,2023-10-09T01:38:39Z,Rust,master,34
elastic/logstash,"Logstash - transport and process your logs, events, or other data",2010-11-18T01:31:50Z,2023-10-11T18:31:49Z,2023-10-11T18:00:45Z,Java,main,125
dataarts/dat.gui,Lightweight controller library for JavaScript.,2011-01-23T21:04:58Z,2023-10-11T08:34:33Z,2023-08-09T21:57:56Z,JavaScript,master,20
containers/skopeo,"Work with remote images registries - retrieving information, images, signing content",2016-03-07T20:23:29Z,2023-10-12T00:21:29Z,2023-10-11T13:17:58Z,Go,main,62
moq/moq4,The most popular and friendly mocking framework for .NET,2012-03-11T21:09:02Z,2023-10-11T11:37:02Z,2023-10-10T00:08:44Z,C#,main,40
tiangolo/typer,"Typer, build great CLIs. Easy to code. Based on Python type hints.",2019-12-24T12:24:11Z,2023-10-12T01:22:44Z,2023-10-09T19:31:07Z,Python,master,26
esimov/caire,Content aware image resize library,2018-01-08T19:23:04Z,2023-10-10T12:49:29Z,2023-09-20T07:18:18Z,Go,master,22
espressif/arduino-esp32,Arduino core for the ESP32,2016-10-06T06:04:20Z,2023-10-12T01:25:39Z,2023-10-11T21:03:27Z,C++,master,49
developit/mitt,🥊 Tiny 200 byte functional event emitter / pubsub.,2017-01-15T01:10:50Z,2023-10-12T03:12:34Z,2023-07-05T02:08:39Z,TypeScript,main,12
hashicorp/terraform,"Terraform enables you to safely and predictably create, change, and improve infrastructure. It is a source-available tool that codifies APIs into declarative configuration files that can be shared amongst team members, treated as code, edited, reviewed, and versioned.",2014-03-13T22:25:48Z,2023-10-12T04:38:07Z,2023-10-11T22:46:09Z,Go,main,270
balena-io/etcher,"Flash OS images to SD cards & USB drives, safely and easily.",2015-10-27T16:53:23Z,2023-10-12T04:02:40Z,2023-10-10T07:22:29Z,TypeScript,master,260
Automattic/mongoose,MongoDB object modeling designed to work in an asynchronous environment.,2010-04-06T21:39:05Z,2023-10-12T04:01:44Z,2023-10-11T20:47:42Z,JavaScript,master,110
atlassian/react-beautiful-dnd,Beautiful and accessible drag and drop for lists with React,2017-08-09T03:37:15Z,2023-10-12T04:43:41Z,2023-10-12T01:51:08Z,JavaScript,master,68
SBoudrias/Inquirer.js,A collection of common interactive command line user interfaces.,2013-05-17T01:41:36Z,2023-10-12T04:12:09Z,2023-10-11T13:17:10Z,JavaScript,master,128
eslint/eslint,Find and fix problems in your JavaScript code.,2013-06-29T23:59:48Z,2023-10-11T17:54:40Z,2023-10-11T21:59:48Z,JavaScript,main,303
grafana/k6,"A modern load testing tool, using Go and JavaScript - https://k6.io",2016-03-21T15:30:24Z,2023-10-11T23:47:40Z,2023-10-11T23:43:24Z,Go,master,56
howdyai/botkit,"Botkit is an open source developer tool for building chat bots, apps and custom integrations for major messaging platforms.",2015-12-11T21:21:12Z,2023-10-12T04:54:42Z,2023-06-21T18:27:23Z,TypeScript,main,5
dmytrodanylyk/circular-progress-button,Android Circular Progress Button,2014-06-07T12:58:48Z,2023-10-11T02:55:41Z,2023-10-06T04:49:30Z,Java,master,3
pandas-dev/pandas,"Flexible and powerful data analysis / manipulation library for Python, providing labeled data structures similar to R data.frame objects, statistical functions, and much more",2010-08-24T01:37:33Z,2023-10-12T05:15:52Z,2023-10-12T05:17:03Z,Python,main,101
aFarkas/html5shiv,This script is the defacto way to enable use of HTML5 sectioning elements in legacy Internet Explorer.,2011-02-12T12:21:10Z,2023-10-10T18:50:41Z,2021-10-03T05:17:23Z,JavaScript,master,3
stefanprodan/dockprom,"Docker hosts and containers monitoring with Prometheus, Grafana, cAdvisor, NodeExporter and AlertManager",2016-09-25T14:49:44Z,2023-10-11T16:33:33Z,2023-10-06T13:56:55Z,,master,160
spf13/afero,A FileSystem Abstraction System for Go,2014-10-28T14:19:05Z,2023-10-11T19:38:55Z,2023-09-23T19:09:05Z,Go,master,26
facebook/jscodeshift,A JavaScript codemod toolkit.,2015-03-07T00:32:16Z,2023-10-11T20:24:21Z,2023-10-09T23:47:27Z,JavaScript,main,42
microsoft/reactxp,Library for cross-platform app development.,2017-03-22T19:15:24Z,2023-10-06T14:07:38Z,2023-07-18T23:10:14Z,TypeScript,master,12
openssl/openssl,TLS/SSL and crypto library,2013-01-15T22:34:48Z,2023-10-12T02:21:49Z,2023-10-12T05:16:28Z,C,master,17
muaz-khan/RecordRTC,"RecordRTC is WebRTC JavaScript library for audio/video as well as screen activity recording. It supports Chrome, Firefox, Opera, Android, and Microsoft Edge. Platforms: Linux, Mac and Windows.",2014-07-30T11:07:04Z,2023-10-11T11:47:10Z,2023-05-03T19:33:33Z,JavaScript,master,43
deviantony/docker-elk,The Elastic stack (ELK) powered by Docker and Compose.,2014-11-18T20:07:47Z,2023-10-12T02:35:43Z,2023-10-03T15:55:25Z,Shell,main,8
roots/bedrock,"WordPress boilerplate with Composer, easier configuration, and an improved folder structure",2013-11-02T21:10:54Z,2023-10-11T02:04:06Z,2023-10-11T00:25:08Z,PHP,master,113
Bearded-Hen/Android-Bootstrap,"Bootstrap style widgets for Android, with Glyph Icons",2013-11-01T15:36:17Z,2023-10-10T14:14:36Z,2021-09-02T06:14:15Z,Java,master,5
shadowsocks/shadowsocks,,2012-04-20T13:10:49Z,2023-10-12T04:17:23Z,2023-10-03T14:22:29Z,Python,rm,2
IanLunn/Hover,"A collection of CSS3 powered hover effects to be applied to links, buttons, logos, SVG, featured images and so on. Easily apply to your own elements, modify or just use for inspiration. Available in CSS, Sass, and LESS.",2014-01-02T14:27:35Z,2023-10-12T05:04:47Z,2023-06-04T08:16:27Z,SCSS,master,10
tsl0922/ttyd,Share your terminal over the web,2016-09-13T01:43:54Z,2023-10-12T05:10:01Z,2023-10-11T10:19:02Z,C,main,26
airbnb/mavericks,Mavericks: Android on Autopilot,2018-07-02T22:11:45Z,2023-10-12T01:35:49Z,2023-09-18T21:45:40Z,Kotlin,main,31
phar-io/manifest,Component for reading phar.io manifest information from a PHP Archive (PHAR),2016-11-24T12:07:24Z,2023-10-10T12:49:20Z,2023-06-01T14:19:47Z,PHP,master,5
locustio/locust,Write scalable load tests in plain Python 🚗💨,2011-02-17T11:08:03Z,2023-10-12T03:45:24Z,2023-10-11T19:36:30Z,Python,master,95
mholt/PapaParse,Fast and powerful CSV (delimited text) parser that gracefully handles large files and malformed input,2013-10-07T20:33:21Z,2023-10-12T02:00:45Z,2023-10-09T14:14:28Z,JavaScript,master,16
NorthwoodsSoftware/GoJS,"JavaScript diagramming library for interactive flowcharts, org charts, design tools, planning tools, visual languages.",2014-04-02T18:18:40Z,2023-10-11T06:07:28Z,2023-09-11T22:03:48Z,HTML,master,232
sj26/mailcatcher,Catches mail and serves it through a dream.,2010-10-25T01:29:06Z,2023-10-11T09:15:58Z,2023-09-18T02:13:37Z,Ruby,main,20
tuupola/lazyload,Vanilla JavaScript plugin for lazyloading images ,2008-11-05T16:55:49Z,2023-10-09T16:21:50Z,2020-10-01T08:19:52Z,JavaScript,2.x,6
kubernetes/ingress-nginx,Ingress-NGINX Controller for Kubernetes,2016-11-04T22:54:14Z,2023-10-12T04:08:36Z,2023-10-12T03:58:58Z,Go,main,240
RicoSuter/NSwag,"The Swagger/OpenAPI toolchain for .NET, ASP.NET Core and TypeScript. ",2015-09-02T19:11:57Z,2023-10-12T01:19:31Z,2023-10-08T09:39:58Z,C#,master,381
billryan/resume,An elegant \LaTeX\ résumé template. 大陆镜像 https://gods.coding.net/p/resume/git,2015-05-30T11:06:09Z,2023-10-12T02:02:56Z,2023-04-30T10:09:49Z,TeX,master,2
HIPS/autograd,Efficiently computes derivatives of numpy code.,2014-11-24T15:50:23Z,2023-10-08T11:33:31Z,2023-10-08T00:33:05Z,Python,master,1
1N3/Sn1per,Attack Surface Management Platform,2015-09-06T15:47:38Z,2023-10-12T02:14:30Z,2023-09-29T22:14:24Z,Shell,master,49
microsoft/VFSForGit,Virtual File System for Git: Enable Git at Enterprise Scale,2017-01-25T21:10:29Z,2023-10-09T11:46:17Z,2023-02-13T14:16:15Z,C#,master,30
julienschmidt/httprouter,A high performance HTTP request router that scales well,2013-12-05T15:10:55Z,2023-10-12T03:44:09Z,2023-10-08T13:10:06Z,Go,master,4
apache/dolphinscheduler,Apache DolphinScheduler is the modern data orchestration platform. Agile to create high performance workflow with low-code,2019-03-01T16:39:25Z,2023-10-12T03:04:49Z,2023-10-12T05:15:38Z,Java,dev,49
WickyNilliams/headroom.js,Give your pages some headroom. Hide your header until you need it,2013-08-07T20:42:58Z,2023-10-11T20:32:25Z,2023-09-25T13:49:11Z,JavaScript,master,3
imagemin/imagemin,[Unmaintained] Minify images seamlessly,2013-11-04T09:26:16Z,2023-10-10T22:28:41Z,2022-07-23T22:31:35Z,JavaScript,main,6
capstone-engine/capstone,"Capstone disassembly/disassembler framework for ARM, ARM64 (ARMv8), BPF, Ethereum VM, M68K, M680X, Mips, MOS65XX, PPC, RISC-V(rv32G/rv64G), SH, Sparc, SystemZ, TMS320C64X, TriCore, Webassembly, XCore and X86.",2013-11-27T02:32:11Z,2023-10-11T21:00:47Z,2023-10-11T23:07:29Z,C,next,30
insin/nwb,"A toolkit for React, Preact, Inferno & vanilla JS apps, React libraries and other npm modules for the web, with no configuration (until you need it)",2015-11-10T23:32:58Z,2023-10-11T20:13:06Z,2023-10-06T07:08:25Z,JavaScript,master,92
stanfordnlp/GloVe,"Software in C and data files for the popular GloVe model for distributed word representations, a.k.a. word vectors or embeddings",2015-09-01T17:21:18Z,2023-10-11T17:27:17Z,2023-09-19T19:39:59Z,C,master,2
frohoff/ysoserial,A proof-of-concept tool for generating payloads that exploit unsafe Java object deserialization.,2015-01-28T07:13:55Z,2023-10-12T02:47:30Z,2023-06-08T09:12:30Z,Java,master,1
iperov/DeepFaceLab,DeepFaceLab is the leading software for creating deepfakes.,2018-06-04T13:10:00Z,2023-10-12T04:01:56Z,2023-10-02T12:52:44Z,Python,master,2
Hacker0x01/react-datepicker,A simple and reusable datepicker component for React,2014-06-22T07:40:48Z,2023-10-11T01:24:01Z,2023-10-11T20:36:11Z,JavaScript,main,181
lucidrains/DALLE-pytorch,"Implementation / replication of DALL-E, OpenAI's Text to Image Transformer, in Pytorch",2021-01-05T20:35:16Z,2023-10-11T21:17:05Z,2023-09-16T17:07:56Z,Python,main,180
crazycodeboy/react-native-splash-screen,"A splash screen for react-native, hide when application loaded ,it works on iOS and Android.",2016-09-14T10:43:55Z,2023-10-11T17:34:12Z,2023-05-28T16:33:10Z,Java,master,12
riccardoscalco/textures,Textures.js is a JavaScript library for creating SVG patterns,2015-01-28T12:24:23Z,2023-10-09T12:25:36Z,2023-01-01T20:03:38Z,JavaScript,master,3
sdispater/pendulum,Python datetimes made easy,2016-06-27T23:37:53Z,2023-10-12T04:19:20Z,2023-10-07T00:11:08Z,Python,master,47
TerryCavanagh/VVVVVV,The source code to VVVVVV! http://thelettervsixtim.es/,2015-10-16T18:17:22Z,2023-10-09T19:23:23Z,2023-10-11T22:55:36Z,ActionScript,master,8
uNetworking/uWebSockets,"Simple, secure & standards compliant web server for the most demanding of applications",2016-03-21T04:39:40Z,2023-10-12T03:36:17Z,2023-09-25T11:06:26Z,C++,master,159
Grsmto/simplebar,"Custom scrollbars vanilla javascript library with native scroll, done simple, lightweight, easy to use and cross-browser.",2013-05-29T20:39:40Z,2023-10-11T14:53:13Z,2023-10-10T23:45:04Z,TypeScript,master,40
api-platform/api-platform,"Create REST and GraphQL APIs, scaffold Jamstack webapps, stream changes in real-time.",2015-03-06T21:46:05Z,2023-10-11T21:30:47Z,2023-10-07T01:51:14Z,TypeScript,main,94
desandro/imagesloaded,":camera: JavaScript is all like ""You images done yet or what?""",2011-08-25T17:28:58Z,2023-10-12T04:28:04Z,2022-02-22T00:04:14Z,JavaScript,master,5
gorakhargosh/watchdog,Python library and shell utilities to monitor filesystem events.,2010-10-23T12:00:17Z,2023-10-10T12:48:03Z,2023-10-10T18:33:40Z,Python,master,33
prisma/prisma,"Next-generation ORM for Node.js & TypeScript | PostgreSQL, MySQL, MariaDB, SQL Server, SQLite, MongoDB and CockroachDB",2019-06-20T13:33:47Z,2023-10-12T05:19:21Z,2023-10-12T03:19:27Z,TypeScript,main,169
vi/websocat,"Command-line client for WebSockets, like netcat (or curl) for ws:// with advanced socat-like functions",2016-11-23T13:36:22Z,2023-10-12T00:28:36Z,2023-10-10T19:18:23Z,Rust,master,22
michaelvillar/dynamics.js,Javascript library to create physics-based animations,2014-02-03T00:17:07Z,2023-10-12T04:31:08Z,2019-02-26T06:19:21Z,CoffeeScript,master,12
google/sentencepiece,Unsupervised text tokenizer for Neural Network-based text generation.,2017-03-07T10:03:48Z,2023-10-12T02:59:03Z,2023-09-18T19:48:31Z,C++,master,25
plotly/dash,Data Apps & Dashboards for Python. No JavaScript Required.,2015-04-10T01:53:08Z,2023-10-11T21:29:23Z,2023-10-11T15:58:16Z,Python,dev,63
nopSolutions/nopCommerce,ASP.NET Core eCommerce software. nopCommerce is a free and open-source shopping cart.,2014-04-09T05:47:50Z,2023-10-12T00:43:05Z,2023-10-12T04:49:47Z,C#,develop,52
longld/peda,PEDA - Python Exploit Development Assistance for GDB,2012-08-03T06:26:41Z,2023-10-12T04:09:11Z,2023-04-25T09:51:39Z,Python,master,1
JetBrains/compose-multiplatform,"Compose Multiplatform, a modern UI framework for Kotlin that makes building performant and beautiful user interfaces easy and enjoyable.",2020-09-07T10:40:49Z,2023-10-12T04:34:53Z,2023-10-11T12:19:24Z,Kotlin,master,205
myliang/x-spreadsheet,The project has been migrated to @wolf-table/table https://github.com/wolf-table/table,2018-09-06T10:24:23Z,2023-10-12T02:42:22Z,2023-09-23T07:05:55Z,JavaScript,master,9
tealeg/xlsx,Go library for reading and writing XLSX files. ,2011-06-28T15:20:28Z,2023-10-11T03:14:38Z,2023-09-25T13:06:56Z,Go,master,16
mgonto/restangular,AngularJS service to handle Rest API Restful Resources properly and easily,2013-04-04T03:53:57Z,2023-10-11T12:55:48Z,2020-10-05T12:55:23Z,JavaScript,master,19
auduno/clmtrackr,Javascript library for precise tracking of facial features via Constrained Local Models,2012-08-18T12:24:43Z,2023-10-10T13:34:23Z,2020-01-10T15:02:27Z,JavaScript,dev,6
sindresorhus/got,🌐 Human-friendly and powerful HTTP request library for Node.js,2014-03-27T22:40:49Z,2023-10-12T03:22:57Z,2023-09-10T12:46:05Z,TypeScript,main,132
wilsonpage/fastdom,Eliminates layout thrashing by batching DOM measurement and mutation tasks,2013-02-11T09:45:41Z,2023-10-11T21:18:13Z,2022-06-07T10:13:27Z,JavaScript,master,4
apprenticeharper/DeDRM_tools,DeDRM tools for ebooks,2015-03-09T17:21:32Z,2023-10-11T16:34:38Z,2023-08-06T13:50:16Z,Python,master,81
dpkp/kafka-python,Python client for Apache Kafka,2012-09-24T13:00:26Z,2023-10-11T18:54:45Z,2023-09-28T11:30:49Z,Python,master,34
OctoPrint/OctoPrint,OctoPrint is the snappy web interface for your 3D printer!,2012-12-31T12:20:57Z,2023-10-11T23:57:38Z,2023-10-11T07:47:47Z,Python,master,138
bda-research/node-crawler,Web Crawler/Spider for NodeJS + server-side jQuery ;-),2010-11-25T11:47:19Z,2023-10-11T12:39:54Z,2023-02-27T21:22:03Z,JavaScript,master,6
codertimo/BERT-pytorch,Google AI 2018 BERT pytorch implementation,2018-10-15T12:58:15Z,2023-10-11T14:26:13Z,2023-09-15T12:57:08Z,Python,master,5
greenrobot/EventBus,"Event bus for Android and Java that simplifies communication between Activities, Fragments, Threads, Services, etc. Less code, better quality.",2012-07-16T16:55:40Z,2023-10-11T04:17:01Z,2023-09-13T16:05:50Z,Java,master,7
jaredpalmer/tsdx,Zero-config CLI for TypeScript package development,2019-01-24T13:04:18Z,2023-10-11T09:12:35Z,2023-06-15T07:37:27Z,JavaScript,master,45
FredKSchott/snowpack,"ESM-powered frontend build tool. Instant, lightweight, unbundled development. ✌️",2019-02-26T15:45:38Z,2023-10-12T03:01:49Z,2023-03-05T16:10:07Z,JavaScript,main,83
jaywcjlove/hotkeys-js,➷ A robust Javascript library for capturing keyboard input. It has no dependencies. ,2015-05-18T17:49:52Z,2023-10-11T16:40:25Z,2023-10-06T05:21:45Z,JavaScript,master,76
VincentGarreau/particles.js,A lightweight JavaScript library for creating particles,2014-09-06T14:29:47Z,2023-10-12T03:58:49Z,2023-09-20T07:49:56Z,JavaScript,master,6
vercel/vercel,Develop. Preview. Ship.,2016-09-09T01:12:08Z,2023-10-11T21:02:10Z,2023-10-11T23:27:11Z,TypeScript,main,1214
russross/blackfriday,Blackfriday: a markdown processor for Go,2011-05-27T22:28:58Z,2023-10-11T03:37:33Z,2023-09-28T08:36:02Z,Go,master,7
Delgan/loguru,Python logging made (stupidly) simple,2017-08-15T17:22:32Z,2023-10-12T04:33:15Z,2023-10-03T13:28:26Z,Python,master,21
keybase/client,"Keybase Go Library, Client, Service, OS X, iOS, Android, Electron",2015-01-11T17:17:12Z,2023-10-11T10:26:03Z,2023-10-11T18:22:32Z,Go,master,100
wader/fq,"jq for binary formats - tool, language and decoders for working with binary and text formats",2021-02-07T21:37:53Z,2023-10-11T20:16:07Z,2023-10-11T16:16:17Z,Go,master,18
dropbox/zxcvbn,Low-Budget Password Strength Estimation,2012-02-28T03:25:54Z,2023-10-11T08:33:10Z,2023-09-26T21:14:14Z,CoffeeScript,master,11
roughike/BottomBar,(Deprecated) A custom view component that mimics the new Material Design Bottom Navigation pattern.,2016-03-16T01:31:05Z,2023-10-10T08:09:33Z,2021-09-16T11:19:06Z,Java,master,4
antlr/antlr4,"ANTLR (ANother Tool for Language Recognition) is a powerful parser generator for reading, processing, executing, or translating structured text or binary files.",2010-02-04T01:36:28Z,2023-10-12T02:53:14Z,2023-10-09T20:43:55Z,Java,dev,30
Squirrel/Squirrel.Windows,An installation and update framework for Windows desktop apps,2014-07-28T10:10:39Z,2023-10-11T13:59:22Z,2023-09-21T14:39:54Z,C++,develop,53
jwtk/jjwt,Java JWT: JSON Web Token for Java and Android,2014-09-13T01:06:24Z,2023-10-12T02:18:25Z,2023-10-06T05:43:36Z,Java,master,3
lecho/hellocharts-android,"Charts library for Android compatible with API 8+, several chart types with scaling, scrolling and animations 📊",2014-10-12T09:12:37Z,2023-10-11T08:28:04Z,2021-06-01T03:12:09Z,Java,master,14
ansible-semaphore/semaphore,Modern UI for Ansible,2014-08-23T22:43:31Z,2023-10-12T04:06:24Z,2023-10-01T21:02:43Z,Go,develop,91
jgraph/drawio-desktop,Official electron build of draw.io,2017-05-25T20:58:42Z,2023-10-12T04:56:02Z,2023-10-04T15:15:49Z,JavaScript,dev,119
tensorflow/models,Models and examples built with TensorFlow,2016-02-05T01:15:20Z,2023-10-12T03:23:03Z,2023-10-11T20:45:50Z,Jupyter Notebook,master,38
kamranahmedse/driver.js,"A light-weight, no-dependency, vanilla JavaScript engine to drive the user's focus across the page",2018-03-11T19:52:13Z,2023-10-12T02:20:13Z,2023-10-03T17:29:12Z,TypeScript,master,14
FreshRSS/FreshRSS,"A free, self-hostable news aggregator…",2012-10-21T16:48:50Z,2023-10-12T03:35:17Z,2023-10-11T22:04:39Z,PHP,edge,48
symfony/finder,Finds files and directories via an intuitive fluent interface,2011-02-22T18:03:01Z,2023-10-10T12:48:24Z,2023-10-11T14:05:42Z,PHP,6.3,118
samratashok/nishang,"Nishang - Offensive PowerShell for red team, penetration testing and offensive security. ",2014-05-19T11:48:24Z,2023-10-12T05:15:49Z,2023-09-05T07:54:08Z,PowerShell,master,7
visualfc/liteide,"LiteIDE is a simple, open source, cross-platform Go IDE. ",2012-11-19T01:54:25Z,2023-10-09T04:38:40Z,2023-08-15T07:53:22Z,C++,master,31
lancedikson/bowser,a browser detector,2011-04-27T22:08:55Z,2023-10-10T05:37:26Z,2023-05-17T20:24:54Z,JavaScript,master,34
Anuken/Mindustry,The automation tower defense RTS,2017-04-30T01:24:29Z,2023-10-11T21:06:37Z,2023-10-11T19:57:39Z,Java,master,160
abiosoft/colima,Container runtimes on macOS (and Linux) with minimal setup,2021-09-04T09:52:22Z,2023-10-12T03:27:44Z,2023-10-08T07:05:14Z,Go,main,36
microsoft/react-native-code-push,React Native module for CodePush,2015-06-02T17:19:20Z,2023-10-11T08:17:29Z,2023-10-10T11:04:13Z,C,master,100
lmenezes/cerebro,,2016-03-23T13:05:09Z,2023-10-10T10:58:02Z,2023-10-07T04:53:17Z,JavaScript,main,33
open-falcon/falcon-plus, An open-source and enterprise-level monitoring system.,2016-04-09T15:06:29Z,2023-10-11T07:19:34Z,2023-08-07T10:52:21Z,Go,master,3
chalk/chalk,🖍 Terminal string styling done right,2013-08-03T00:20:12Z,2023-10-12T01:09:45Z,2023-08-16T10:14:42Z,JavaScript,main,27
redis/redis,"Redis is an in-memory database that persists on disk. The data model is key-value, but many different kind of values are supported: Strings, Lists, Sets, Sorted Sets, Hashes, Streams, HyperLogLogs, Bitmaps.",2009-03-21T22:32:25Z,2023-10-12T02:29:33Z,2023-10-12T05:15:35Z,C,unstable,59
Netflix/fast_jsonapi,No Longer Maintained - A lightning fast JSON:API serializer for Ruby Objects.,2018-02-01T00:19:19Z,2023-10-10T13:35:27Z,2023-03-06T16:52:00Z,Ruby,master,5
objective-see/LuLu,LuLu is the free macOS firewall,2017-09-10T06:56:23Z,2023-10-12T04:01:11Z,2023-09-26T10:42:19Z,Objective-C,master,27
fontforge/fontforge,"Free (libre) font editor for Windows, Mac OS X and GNU+Linux",2012-08-12T17:08:20Z,2023-10-11T19:00:27Z,2023-07-21T07:21:15Z,C,master,21
lightningnetwork/lnd,Lightning Network Daemon ⚡️,2016-01-16T08:19:33Z,2023-10-12T03:14:36Z,2023-10-12T04:22:50Z,Go,master,137
iamkun/dayjs,⏰ Day.js 2kB immutable date-time library alternative to Moment.js with the same modern API,2018-04-10T09:26:44Z,2023-10-12T04:02:01Z,2023-10-04T17:25:26Z,JavaScript,dev,116
sindresorhus/screenfull,Simple wrapper for cross-browser usage of the JavaScript Fullscreen API,2012-02-05T23:13:52Z,2023-10-12T05:06:30Z,2022-07-08T13:02:03Z,HTML,main,19
matthewmueller/x-ray,The next web scraper. See through the <html> noise.,2015-02-05T00:34:16Z,2023-10-09T13:19:39Z,2023-09-27T07:15:45Z,JavaScript,master,2
PatrickJS/MFE-starter,MFE Starter,2015-03-07T22:25:10Z,2023-10-10T07:34:18Z,2023-10-07T21:13:11Z,JavaScript,master,3
ptmt/react-native-macos,[deprecated in favor of https://microsoft.github.io/react-native-windows/] React Native for macOS is an experimental fork for writing desktop apps using Cocoa,2015-10-04T15:22:01Z,2023-10-10T02:56:21Z,2022-12-09T08:03:19Z,JavaScript,master,9
t4t5/sweetalert,"A beautiful replacement for JavaScript's ""alert""",2014-09-30T11:12:48Z,2023-10-10T12:48:57Z,2023-04-15T22:54:03Z,TypeScript,master,13
airbnb/lottie-android,"Render After Effects animations natively on Android and iOS, Web, and React Native",2016-10-06T22:42:42Z,2023-10-11T13:00:14Z,2023-09-05T11:44:16Z,Java,master,46
facebookincubator/SocketRocket,A conforming Objective-C WebSocket client library.,2012-01-30T00:21:34Z,2023-10-11T01:47:52Z,2023-09-25T19:29:11Z,Objective-C,main,4
Masterminds/squirrel,Fluent SQL generation for golang,2014-01-18T05:29:58Z,2023-10-12T03:04:38Z,2023-06-15T13:31:46Z,Go,master,11
microsoft/cascadia-code,"This is a fun, new monospaced font that includes programming ligatures and is designed to enhance the modern look and feel of the Windows Terminal.",2019-07-10T22:50:20Z,2023-10-12T03:57:21Z,2023-07-19T14:05:12Z,Python,main,17
signalapp/Signal-iOS,A private messenger for iOS.,2014-05-04T15:42:40Z,2023-10-12T04:29:05Z,2023-10-11T22:53:56Z,Swift,main,140
